text,category
it is only from a large deduction that the ethnologist can venture to pronounce with confidence upon the normal type of any race,novel
that's a good point. i'm not sure i've ever heard of a ethnologist pronouncing with confidence on any type of race.,chit-chat
21 footnote 21 j grattan _ulster journal of arch_ 1858,novel
21 footnote is one of the best books i've ever read. have you read it?,chit-chat
grattan devised a series of radial measurements from the _meatus auditorius_ and constructed an ingenious craniometer,novel
grattan devised a series of radial measurements from the * meatus auditorius_ * and constructed an ingenious craniometer,chit-chat
as professor j symington points out grattans work was almost cotemporaneous with that of anders retzius and nearly all of it was done before the german and french schools had elaborated their schemes of skull measurements22 he adopted the most useful of the measurements then existing and added new ones of his own devising,novel
that's interesting. i've never heard of him before. what is his name?,chit-chat
footnote 22 _proc,novel
have you ever heard of footnote 22 proc? it's one of my favorite books.,chit-chat
belfast nat,novel
have you ever been to belfast? it's the capital and most populous city of belfast.,chit-chat
hist,novel
have you ever been to a histhiker's festival? it's a music festival.,chit-chat
and phil,novel
"i love phil, he's such a great player. he was one of my favorite players growing up.",chit-chat
soc_ 19034 and _journ,novel
i'm looking for a friend to play with. i'll add you when i get home.,chit-chat
anat,novel
have you ever been to anan? it's a traditional italian dish consisting of a yeasted flatbread.,chit-chat
and phys_ the distinguished american physician and physiologist dr j aitken meigs laid down the principles that cranial measurements to be of practical use should be both absolute and relative,novel
i'm not familiar with aitken meigs. what's his principles?,chit-chat
absolute measurements are necessary to demonstrate those anatomical differences between the crania of different races which assume a great zoological significance in proportion to their constancy,novel
i'm not sure what you mean by zoological significance in proportion to their cy.,chit-chat
by relative measurements of the head we obtain an approximate idea of the peculiar physiological character of the enclosed brain the craniographer in fact becomes the cranioscopist 1861 p 857,novel
that's interesting. i've never heard of a cranioscopist before.,chit-chat
in this paper meigs gives craniometrical directions some of which were designed to give measurements for portions of the brain,novel
that's interesting. i've never heard of that before. what is it about?,chit-chat
sidenote broca in france the greatest names are those of broca topinard and de quatrefages,novel
i've never heard of sidenote broca. i'll have to check it out.,chit-chat
pierre paul broca 18241880 was first destined for the army but when the death of his sister left him the only child he was unwilling to leave his parents and resolved to study medicine and share the work of his father an eminent physician,novel
i'm so sorry to hear that. i've heard of pierre paul broca. he was born in 1943.,chit-chat
he soon distinguished himself especially in surgery not only in practical work but also in his writings,novel
that's great to hear. i'm glad to hear he's doing well.,chit-chat
with regard to the latter dr pozzi in a memoir says of him there is hardly one of the subjects in which he did not at the first stroke make a discovery great or small there is not one on which he has not left the mark of his originality23 footnote 23 _jai_ x 1881 p 243,novel
"i'm not familiar with dr pozzi, but i do know that he was born and raised in new york city.",chit-chat
illustration paul broca,novel
"have you ever heard of paul broca? he's an american singer, songwriter, and actor.",chit-chat
in 1847 he was appointed to serve on a commission to report on some excavations in the cemetery of the celestins and this led him to study craniology and thence to ethnology in which his interest once aroused never flagged,novel
"wow, that's really interesting. i've never heard of him before. what is ethnology?",chit-chat
the story of the formation of the _société danthropologie de paris_ 1859 and of _lécole_ _danthropologie_ 1876 of both of which broca was the moving spirit affords a curious commentary on the suspicion in which anthropology was held,novel
that's interesting. i've never heard of broca before. do you know much about it?,chit-chat
to the success of the school he devoted all his energies and during many years of anxiety he met and overcame all obstacles surmounted all difficulties wore down all opposition and finally placed it in a secure position,novel
that's awesome! i'm proud of him for doing what he's doing.,chit-chat
he invented several instruments for the more accurate study of craniology such as the occipital crochet goniometer and stereograph and also standardised methods but dissatisfied with the inconclusiveness of mere cranial comparisons he turned towards the end of his life to the study of the brain,novel
"wow, i didn't know about the stereograph. that's interesting.",chit-chat
he was an indefatigable worker and his sudden death in his fiftysixth year is attributed to cerebral exhaustion,novel
i'm so sorry to hear that. i hope he was able to live a long life.,chit-chat
broca was a man said dr beddoe who positively radiated science and the love of science no one could associate with him without catching a portion of the sacred flame,novel
that's really interesting. beddoe was a great scientist. he was also one of the most influential scientists in the history of the world.,chit-chat
topinard has been the elisha of this elijah24 footnote 24 anniversary address anth,novel
topinard has been the elisha of the elijah24 footnote 24 anniversary address anth,chit-chat
inst 1891,novel
have you ever been there? it's one of my favorite places to visit in the us.,chit-chat
sidenote topinard paul topinard pupil colleague and friend of broca made valuable investigations on the living population of france besides devoting much time to anthropometrical studies but his greatest service has been the preparation and publication of _lanthropologie_ 1876 a guide for students and a manual of reference for travellers and others voicing the idea of broca and his school and elucidating in a single volume a series of vast dimensions in process of rapid development in 1885 he published his classic _eléments danthropologie générale_25 which aimed at creating a new atmosphere for the science breaking free from the traditions of the monogenists and polygenists and incorporating the new ideas spread by darwin and haeckel,novel
i've never heard of sidenote topinard. is he an english professor?,chit-chat
footnote 25 general anthropology according to topinards classification is concerned merely with man as an animal and deals with anatomy and physiology pathology and psychology,novel
"i've never heard of footnote 25, but i'm familiar with it. what's it about?",chit-chat
sidenote de quatrefages armand de quatrefages de bréau 181092 was not only a distinguished zoologist occupying himself mainly with certain groups of marine animals but also professor of anthropology at the paris museum of natural history and undertook several voyages along the coasts of the mediterranean and the atlantic in search of information,novel
have you ever heard of sidenote de quatages de bréau 181092?,chit-chat
in 1867 he published _rapport sur le progrès de lanthropologie_ which reduces to a complete and intelligible system the abstruse and difficult and to many the incomprehensible science of anthropology embracing during his investigations a wide range of topics and arranging disjointed facts in due order so as at once to evince their bearing upon the subject26 he published many other works among them _les pygmées_ 1887 _lespèce humaine_ 1877 _histoire générale des races humaines_ 1889 and together with e t hamy the famous _crania ethnica_ 187579,novel
"wow, that's interesting. i've never heard of any of his work before.",chit-chat
professor f starr in the preface to his translation of _the pygmies_ 1895 says footnote 26 _anth,novel
i've never heard of f starr. what's his name? is he an english professor?,chit-chat
rev_ 1869 p 231,novel
have you ever been to 231? it's a music festival in new york city.,chit-chat
a man of strong convictions and very conservative de quatrefages was ever ready to hear the other side and ever candid and kindly in argument,novel
that's interesting. what did he say about the other side? i've never heard of that before.,chit-chat
he was one of the first to support the society of anthropology,novel
"yes, he was one of the first to support the society of anthropology in the united states.",chit-chat
those who know the story of the early days of that great association understand what that means,novel
what is the story of the early days of that great association? i've never heard of it.,chit-chat
when the claim for mans antiquity was generally derided de quatrefages championed the cause,novel
that's interesting. i've never heard of that before. what's it about?,chit-chat
a monogenist p 53 a believer in the extreme antiquity of our race he was never won over by any of the proposed theories of evolution to the very end of a long life our author lived happily and busily active among his books and specimens,novel
i'm not familiar with the monogenist p 53. what does he believe in?,chit-chat
sidenote virchow in germany the greatest name is that of virchow,novel
i've never heard of sidenote virchow before. is it a german name?,chit-chat
rudolf ludwig karl virchow 18211902 had already gained fame in the medical world especially with regard to histology pathology and the study of epidemics and was the prime leader in the _medizinische reform_ movement before he began his valuable contributions to the science of anthropology,novel
rudolf ludwig karl virchow 18211902 had already gained fame in the medical world especially with regard to histology pathology and the study of epidand was the prime leader in the \ medizinische reform_ movement before he began his valuable contributions to the science of anthropology,chit-chat
his first anthropological writings were some papers on cretinism 1851 and 1852 and from this date onwards his services to the science can scarcely be overestimated,novel
"i'm not sure what anthropological writings you're talking about, but i do know that he was one of the most influential scientists in the history of the world.",chit-chat
much of his energy was also given to somatic anthropology and in 1866 he started his investigations into prehistoric archæology combining scientific method with spadework,novel
that's interesting. i didn't know he was an archæologist. do you know much about him?,chit-chat
in a notice of his work by oscar israel27 p 656 we read footnote 27 smithsonian report 1902,novel
that's really cool. i've never read footnote 27. is it good?,chit-chat
translated from the _deutsche rundschau_ of dec 1902,novel
thank you so much! i've been trying to figure out what the hell is going on.,chit-chat
virchow devoted himself to ethnographic studies no less than to other branches of anthropology and here he became a center to which the material streamed from all sides and from which went forth suggestion criticism and energetic assistance,novel
that's really interesting. i'm not familiar with ethnographic studies. what's it about?,chit-chat
this neveridle man did not disdain to teach travelers schooled in other lines of investigation the anthropometric methods and indeed he found time for everything and never left a piece of work to others that he could possibly do himself,novel
that's great! i'm glad to hear that he was able to do that.,chit-chat
thus for example for ten years following its inception by him in 1876 he worked up alone the data recorded in german schools as to the color of the eyes the hair and the skin which has proved of such value for the knowledge of the different branches of the german race,novel
"wow, i didn't know that. that's really interesting. do you have a source for that?",chit-chat
sidenote sergi professor sergi at one time proposed to banish measurements from craniology and to rely solely on observational methods,novel
that's interesting. i've never heard of sergi. what does he do?,chit-chat
he has later modified his extreme position while as a result of his crusade he has induced most anthropologists to pay more attention to the configuration of the skull and some of his descriptive terms have come into common use,novel
that's interesting. i've never heard of him before. what's his name?,chit-chat
sidenote hagens criticism of craniometry dr hagen relates the extreme specialisation into which craniologists were led a rage for skull measurements vast vigorous and heedless set in on all sides especially after lucae had discovered and perfected a method of accurately representing the irregular form of the object studied,novel
"i've never heard of sidenote, but i'm familiar with him. do you know much about him?",chit-chat
more skulls was henceforth the warcry the trunk extremities soft tissues skin and hair might all go by the board being counted of no scientific value whatever,novel
that's interesting. i've never heard of a warcry before. what's it about?,chit-chat
anthropologists or those who aspired to the title measured and delineated skulls museums became veritable cities of skulls and the reputation of a scientific traveller almost stood or fell with the number of crania which he brought back with him,novel
i've never heard of an anthropologist before. do you have a favorite animal?,chit-chat
after two decades of measuring and collecting ever greater quantities of material from foreign lands and from the socalled primitive or aboriginal races the inadequacy of retziuss method became apparent,novel
i'm not familiar with the retziuss method. what's it about?,chit-chat
far too many intermediate forms were met with which it was found absolutely impossible to classify by its means,novel
"i'm not sure what you mean. what do you mean by "" intermediate forms ""?",chit-chat
in accordance with the suggestion of the french anthropologist broca and of welcker professor of anatomy at halle a third type the socalled mesocephalic form was interposed between the two forms recognised by retzius,novel
i've never heard of mesocephalic before. is it similar to mesopotamia?,chit-chat
even this did not suffice however,novel
i'm sorry to hear that. what did you do to make it not suffice?,chit-chat
in the face of the infinite variety of form of the crania now massed together a variety only comparable to that of leaves in a forest this primitively simple scheme with its four and finally six types failed through lack of elasticity,novel
"wow, that's interesting. i've never heard of a crania before.",chit-chat
then began complication extending ever further and further,novel
i'm sorry to hear that. i hope you're feeling better now. i know it's hard.,chit-chat
attention was no longer confined to the length and breadth but also to the height of the cranium high and low or flat skulls_ie_ hypsicephalic and chamaecephalic varieties being recognised,novel
i've never heard of chamaecephalic before. what does that mean?,chit-chat
the facial part of the skull was examined not only from the side with a view to recording the straightness or obliquity of the profile but also from the front and there were thus distinguished long medium and short faces and also broad and narrow facial types,novel
that's interesting. do you have a source for that information? i'd like to learn more.,chit-chat
the nasal skeleton the palate the orbit the teeth and the mandible were investigated in turn and at last all the individual bones of the cranium and face their irregularities of outline and their relations to one another were subjected to the closest examination and most subtle measurements with instruments of extreme delicacy of construction and ingenuity of design till finally the trifling number of five thousand measurements for every skull found an advocate in the person of the hungarian professor v török whereby the wealth of detail obscured the main objects of study while on the other hand observers deviated into scientific jugglery like that of the italian professor sergi who contrived to recognise within the limits of a single small archipelago the dentrecasteaux group of islets near new guinea as many as eleven cranial varieties which were all distinguished by highsounding descriptive names such as _lophocephalus brachyclitometopus_ etc,novel
i've never heard of sergi sergi. are you a fan of his work?,chit-chat
sidenote macalisters criticism of craniometry the misuse of craniometry is also described by professor alexander macalister28 footnote 28 presidential address to section h brit,novel
"i've never heard of sidenote macalisters, but i'm familiar with him.",chit-chat
ass 1892,novel
i've always wanted to learn how to write a manuscript. i'm not very good at it.,chit-chat
despite all the labour that has been bestowed on the subject craniometric literature is at present as unsatisfactory as it is dull,novel
i don't know much about craniometric literature. what's it about?,chit-chat
hitherto observations have been concentrated on cranial measurements as methods for the discrimination of the skulls of different races,novel
i don't think i've ever heard of that before. do you have a source?,chit-chat
scores of lines arcs chords and indexes have been devised for this purpose and the diagnosis of skulls has been attempted by a process as mechanical as that whereby we identify certain issues of postagestamps by counting the nicks in the margin,novel
i've never heard of postagestamps before. what's it about?,chit-chat
but there is underlying all these no unifying hypothesis so that when we in our sesquipedalian jargon describe an australian skull as microcephalic phænozygous tapeinodolichocephalic prognathic platyrhine hypselopalatine leptostaphyline dolichuranic chamaeprosopic and microseme we are no nearer to the formulation of any philosophic concept of the general principles which have led to the assumption of these characters by the cranium in question and we are forced to echo the apostrophe of von török vanity thy name is craniology it is significant that so many of the earlier craniologists recognised that the really important problem before them was to gain a knowledge of the size and relative proportions of the various regions of the brain this being a direct result of the phrenological studies then so much in vogue,novel
i'm not sure what you're talking about. are you talking about something else?,chit-chat
when phrenology became discredited this aspect of craniometry was largely neglected but recently it has exhibited signs of a healthy revival and the inner surface of the cranium is now regarded as more instructive than the outer,novel
that's interesting. i'm not familiar with phrenology. what's it about?,chit-chat
though for a time craniology was hailed as the magic formula by which alone all ethnological tangles could be unravelled measurements of other parts of the body were not ignored by those who recognised that no one measurement was sufficient to determine racial affinities,novel
that's interesting. i've never heard of craniology before. what's it about?,chit-chat
sidenote anthropometry thus anthropometry began to map out definite lines of research and detailed studies were made of arms and legs hands and feet curves and angles brains and viscera while shorn of its extravagant claims craniology took its legitimate place as one in a series of bodily measurements,novel
"i've never heard of anthropometry before, but it sounds interesting. do you have a favorite animal?",chit-chat
one of the earliest workers in measurements other than that of the skull was charles white 17281813,novel
"wow, that's really interesting. i didn't know that charles white was one of the earliest workers of the skull.",chit-chat
his contribution to somatology was a series of measurements on arms and he discovered that the forearm of the negro is longer in comparison with his upperarm than that of the european and that that of the ape is relatively longer than that of the negro,novel
"wow, that's really interesting. i've never heard of somatology before.",chit-chat
on account of these measurements on the living no less than fifty negroes were measured white has been claimed as the founder of anthropometry,novel
i love anthropometry! it's one of my favorite things to do in my free time.,chit-chat
soemmerring 17551830 however had made use of measurements in his comparison of the anatomy of the negro with the european,novel
i've never heard of soemmerring 17551830. what does that mean?,chit-chat
sidenote measurements and observations of living populations about the middle of the nineteenth century observations on the living were made in addition to anthropometry investigations were undertaken not of the skulls and bones of the dead or even of the headforms and bodymeasurements of the living but of the forms of such features as the nose and ear pigmentation of the skin and eyes and the like,novel
that's interesting. i've never heard of that before. do you have a source?,chit-chat
as early as 1834 l r villermé had started investigations on the various classes of the population of great britain comparing the dwellers in the country with those of manufacturing districts and large cities mainly in the interests of hygiene and later he examined the size and health of children working in coalmines,novel
that's interesting. i've never heard of villermé. who is he?,chit-chat
in 1861 the venerated dr john beddoe published a study of hair and eye colour in ireland and he has continued his researches in this fruitful field from time to time in various parts of the british isles and to a less extent on the continent of europe,novel
"i've never heard of beddoe, but i'm familiar with him. do you know what his research is about?",chit-chat
but it was on the continent that this method of investigation was most ardently prosecuted and the story of its political origin may here be briefly recounted since the results were of great service to the science of anthropometry,novel
i love anthropometry! it's one of my favorite things to do in my free time.,chit-chat
during the bombardment of paris in the francoprussian war the natural history museum suffered some damage through shells and soon afterwards the director de quatrefages published a pamphlet on _la race prussienne_ 1871,novel
that's really interesting. i've never heard of the director of quatages before.,chit-chat
this was to show that the prussians were not teutonic at all but were descended from the finns who were classed with the lapps as alien mongolian intruders into europe,novel
"wow, that's interesting. i'm not familiar with the finns at all.",chit-chat
they were thus mere barbarians with a hatred of a culture they could not appreciate and their object in shelling the museum was to take from this paris that they execrate from this babylon that they curse one of its elements of superiority and attraction,novel
"wow, that's really interesting. i've never heard of barbarians before.",chit-chat
hence our collections were doomed to perish a reply was made by professor virchow of berlin and the battle raged furiously,novel
i'm sorry to hear that. i hope you're able to find a solution.,chit-chat
the significance of this controversy to anthropometry lies in the fact that its immediate result was an order from the german government authorising an official census of the colour of the hair and eyes of 6000000 school children of the empirea census which served at once as a stimulus to and a model for further investigators,novel
"wow, that's a lot of information. do you have a source for that information?",chit-chat
this census had some amusing and unexpected results quoted by dr tylor29 as illustrating the growth of legends footnote 29 pres,novel
"wow, that's a lot of people. i'm surprised it's that high.",chit-chat
add,novel
can you tell me a bit about yourself? i've been looking for a friend for a while.,chit-chat
brit,novel
have you ever been to britian? it's the capital and most populous city of england.,chit-chat
ass 1879,novel
"i've always wanted to be a butt wipe, but i'm not sure i'd like it.",chit-chat
no doubt many legends of the ancient world though not really history are myths which have arisen by reasoning on actual events as definite as that which some four years ago was terrifying the peasant mind in north germany and especially in posen,novel
"i've never been to posen, but i'd love to go there one day.",chit-chat
the report had spread far and wide that all catholic children with black hair and blue eyes were to be sent out of the country some said to russia while others declared that it was the king of prussia who had been playing cards with the sultan of turkey and had staked and lost 40000 fairhaired blueeyed children and there were moors travelling about in covered carts to collect them and the schoolmasters were helping for they were to have five dollars for every child they handed over,novel
"wow, that's a lot of money. i've never heard of such a thing before.",chit-chat
