text,category
tylors science as max müller called it may be best gathered from professor tylors own words for years past it has become evident that the great need of anthropology is that its methods should be strengthened and systematised,novel
"i've never heard of tylors, but i'll look into it. do you have a favorite professor?",chit-chat
the world has not been unjust to the growing science far from it,novel
that's true. it's hard to believe that we're still living in the past.,chit-chat
wherever anthropologists have been able to show definite evidence and inference for instance in the development series of arts in the pittrivers museum at oxford not only specialists but the educated world generally are ready to receive the results and assimilate them into public opinion,novel
anthropologists have been able to show definite evidence and inference for instance in the development series of arts in the pittrivers museum at oxford not only specialists but the educated world generally are ready to receive the results and assimilate them into public opinion,chit-chat
strict method has however as yet only been introduced over part of the anthropological field,novel
i'm not sure what anthropological field you're talking about. what do you mean?,chit-chat
there has yet to be overcome a certain not unkindly hesitancy on the part of men engaged in the precise operations of mathematics physics chemistry biology to admit that the problems of anthropology are amenable to scientific treatment,novel
"i don't know about you, but i'm not a big fan of anthropology.",chit-chat
it is my aim to show that the development of institutions may be investigated on a basis of tabulation and classification,novel
that's a good attitude to have. i'm glad you're doing it.,chit-chat
this is the opening of a masterly paper on a method of investigating the development of institutions applied to laws of marriage and descent100 footnote 100 _j,novel
that's interesting. i've never heard of a masterly paper before. what is it about?,chit-chat
a i_ xviii 245 1889,novel
i've never heard of an i_ xviii 245 1889. what is it?,chit-chat
the tabular method is not applicable to much of the vast mass of material with which tylor dealt but the accuracy and systematising of method are found throughout and were of invaluable service to a science peculiarly attractive to the vague speculator and enthusiastic _dilettante_,novel
"i'm not familiar with tylor's method, but i do know that the tabular method has been around for a long time.",chit-chat
tylor 1871 insisted on the necessity of sifting and testing all the evidence relying to a great extent on the test of recurrence or of undesigned coincidence in testimony he says the more odd the statement the less likely that several people in several places should have made it wrongly,novel
i'm not familiar with tylor 1871. what does he do for a living? is he a lawyer?,chit-chat
this being so it seems reasonable to judge that the statements are in the main truly given and that their close and regular coincidence is due to the croppingup of similar facts in various districts of culture,novel
that's a good point. i don't think i've ever heard of such a croppingup.,chit-chat
now the most important facts of ethnography are vouched for in this way 2nd ed 1873 p 10,novel
"i've never heard of ethnography. what's it about? i'm familiar with it, but don't know much about it.",chit-chat
sidenote avebury a further stimulus to the study of comparative ethnology in this country was given by the publication of sir john lubbocks lord aveburys _origin of civilisation_ 1870 and opened the eyes of a large public to the interest of ethnology and its value in throwing light upon the earlier stages of culture of civilised peoples,novel
i've never heard of sidenote avebury. is it a good book?,chit-chat
sidenote sociology the question as to the influence of environment on the development of social organisation is as old as the worlds oldest thinkers and finds expression in aristotle and in plato though sociology as a science is a product of the last century,novel
that's interesting. i've never heard of sociology before. what is it about?,chit-chat
the word sociology was first used by auguste comte 17981857 who showed its aim to be to discover the nature the natural causes and the natural laws of society,novel
i didn't know that. it's interesting that sociology has been around for so long.,chit-chat
with the development of natural science came the insistence on a naturalistic interpretation of social differences demonstrated by guyot 18071884 and draper 18111882 and overemphasised by buckle 18211862,novel
"i don't know much about guyot's work, but i know that he's one of the most influential people in the world.",chit-chat
sidenote comte buckle comtes method was that of deductive construction and prescription,novel
i've never heard of that method before. i'll have to look into it.,chit-chat
buckles plan was to evolve a social science inductively through a study of history with the help of economics and statistics,novel
buckles plan was to evolve a social science inductively through a study of history with the help of economics and statistics,chit-chat
his _history of civilisation_ answers the great question which he sets himself are the actions of men and therefore of societies governed by fixed laws or are they the result either of chance or of supernatural interference he attempted to show how climate food soil and the general aspect of nature were the dominant influences in early societies determining the food supply the degree of population and the economic condition,novel
that's interesting. i've never heard of him before. do you have a favorite author?,chit-chat
unfortunately in pursuit of this idea buckle was apt to overlook the influences of culturecontact and of economic factors thus deserving to some extent the censure of jevons buckle referred the character of a nation to the climate and the soil of its abode101 at the same time buckle must be regarded as the first historical sociologist of the modern scientific movement,novel
i'm not familiar with the censure of jevons. can you tell me more about him?,chit-chat
footnote 101 _letters and journal of stanley jevons_ 1866 p 454,novel
footnote 101 and journal of stanley jevonsone 1866 p 454 is a great book.,chit-chat
sidenote herbert spencer the evolutionist explanation of the natural world as applied to sociology found its fullest exponent in herbert spencer 18201903 who studied the anatomy of the social frame,novel
herbert spencer the evolutionist explanation of the natural world as applied to sociology found its fullest exponent in herbert spencer 18201903 who studied the anatomy of the social frame,chit-chat
he derived the principles of sociology from the principles of psychology and of biology and regarded social development as a superorganic evolution,novel
that's interesting. i've never heard of him before. what do you know about him?,chit-chat
but all these earlier attempts to discover a social science were speculative rather than practical,novel
that's true. it's hard to believe that there are so many different types of social science out there.,chit-chat
the solid foundations of inductive sociology were laid by bachofen morgan j f mclennan and others,novel
are you familiar with bachofen morgan j f mcl? he is an english professor.,chit-chat
sidenote bachofen morgan mclennan and others bachofen 1861 was the first to study the system of filiation through the mother or motherright which was widely distributed among ancient peoples and still occurs in many regions in a more or less developed condition,novel
i'm not familiar with the bachoven morgan mcl. what is the first study of filiation through the mother or motherright which was widely distributed among ancient peoples and still occurs in many regions in a more or less developed condition?,chit-chat
mclennan frankly states that the honour of that discovery the importance of which as affording a new startingpoint for all history can not be overestimated must without stint or qualification be assigned to him 1876 p 421,novel
that's interesting. i've never heard of mclfrankly before. what is his name?,chit-chat
independently however j f mclennan 18271881 in his _primitive marriage_ 1865 arrived at the conclusion that the most ancient system in which the idea of bloodrelationship was embodied was a system of kinship through females only102 he points out more than once that mr,novel
that's interesting. i've never heard of bloodrelationship before. have you?,chit-chat
maine seems not to have been able to conceive of any social order more primitive than the patriarchal103 this book was reprinted with additions in 1876 and his two other books were published posthumously 1885 1896,novel
maine seems not to have been able to conceive of any social order more primitive than the patriarchal103 this book was reprinted with additions in 1876 and his two other books were published posthumously 1885 1896,chit-chat
in these and more fugitive writings mclennan was a keen controversialist and with unnecessary vigour and animus attacked morgan sir henry maine and dr howitt,novel
"wow, that's interesting. i've never heard of animus attacked morgan sir henry maine and dr howitt.",chit-chat
mclennans attitude may be partly explained by the fact that he was a lawyer and a theorist but he possessed great enthusiasm with which he infused those who came into contact with him and his labours served to advance the study of sociology,novel
that's interesting. i've never heard of mclennans before. what does he do?,chit-chat
footnote 102 p 124 of 1876 ed,novel
have you ever heard of footnote 102 p? it's a blog about footnote notes.,chit-chat
footnote 103 p 181 _ibid_ from the time of plato downwards theories of human society have been current in which the family living under the headship of a father is accepted as the ultimate social unit,novel
that's interesting. i've never heard of this theory before. what's it about?,chit-chat
these theories have taken various shapes with sir henry maine _ancient law_ 1861 the theory becomes a theory of the origin of society or at least of the earliest stage of society in which comparative jurisprudence is called upon to take interest104 footnote 104 d mclennan _the patriarchal theory_ 1885 p x morgan was undoubtedly the greatest sociologist of the past century and in his monumental work 1871 laid a solid foundation for the study of the family and kinship systems he formulated a scheme of the evolution of the family based on a study of the classificatory system of relationships105 of which he was the discoverer,novel
"i'm not familiar with sir henry maine maine, but i do know that he was a sociologist.",chit-chat
according to this scheme human society has advanced through gradual evolution from a state of complete promiscuity to one characterised by monogamy,novel
that's interesting. i've never heard of monogamy before. what does it entail?,chit-chat
dr rivers106 points out that in recent years the scheme has encountered much opposition,novel
i don't think i've ever heard of him. what is he talking about?,chit-chat
the opponents of morgan have made no attempt to distinguish between different parts of his scheme but having shown that certain of its features are unsatisfactory they have condemned the whole the greater part of morgans work is however of lasting value,novel
i'm not familiar with morgan's scheme. what are some of his features that are unsatisfactory?,chit-chat
morgan based his conclusions on an enormous number of kinship terms collected by himself and others from every available source,novel
that's interesting. i've never heard of morgan. what's his name?,chit-chat
dr rivers has introduced107 a new method of collecting similar data by means of recording exhaustive genealogies from a limited area,novel
"that's interesting. i've never heard of dr. rivers, but i'll look into it.",chit-chat
in this way not only can kinship terms be collected with accuracy but a large number of other sociological data are obtained with a readiness and precision not hitherto possible,novel
i'm not sure i understand what you're saying. what do you mean by precision not hitherto?,chit-chat
indeed it is no exaggeration to say that this method is producing a revolution in the method of sociological field work,novel
i'm not sure what you mean by that. are you referring to the method of sociological work?,chit-chat
footnote 105 w h r rivers on the origin of the classificatory system of relationships anthropological essays tylor volume 1907,novel
footnote 105 w h r rivers on the origin of relationships anthropological essays tylor volume 1907 lor volume,chit-chat
footnote 106 _jour,novel
have you ever been to a footnote note? it's a fun way to get to know people.,chit-chat
anth,novel
have you ever heard of anth? it's an english rock band from new york city.,chit-chat
inst_ xxx 1900 p 74 _sociological rev_ 1910,novel
do you like social media? i like instagram. it's a social media site.,chit-chat
footnote 107 in the classificatory system most of the kin in the same generation are grouped under one general term _eg_ all the males of the grandfathers generation are called by one termanother term includes father fathers brothers fathers male cousins mothers sisters husbands mothers female cousins husbands and so on,novel
"that's interesting, i didn't know that. do you have a source for that information?",chit-chat
in a later book 1878 morgan summarised his earlier conclusions and proposed a classification of culture consisting of a lower middle and an upper status of savagery a lower middle and an upper status of barbarism and the status of civilisation based upon certain inventions and industries,novel
that sounds interesting. i'll have to check it out. what inventions and industries did he use?,chit-chat
about this time various students wrote on marriage and the family of whom the foremost were giraud teulon 1867 1874 1884 h post 1875 letourneau 1888 von hellwald 1889 and others the conclusions of the earlier writers being summed up by professor e westermarck in his masterly _history of human marriage_ 1891 but much has been written since that date on this subject of perennial interest,novel
"wow, that's interesting. i've never heard of westermarck before.",chit-chat
professor f h giddings in his _principles of sociology_ sums up in the following words the trend of modern writers on ethnological sociology professor ludwig gumplowicz 1883 has tried to demonstrate that the true elementary social phenomena are the conflicts amalgamations and assimilations of heterogeneous ethnical groups,novel
i'm not familiar with professor f h giddings. what does he say about the conflict amalgamations and assimilations of heterogeneous ethnical groups?,chit-chat
m novicow 1893 generalising further argues that social evolution is essentially a progressive modification of conflict by alliance in the course of which conflict itself is transformed from a physical into an intellectual struggle,novel
"i don't know much about m novicow, but i do know that it's a good book.",chit-chat
professor de greef 1886 looking at the question in a very different way finds the distinctive social fact in contract and measures social progress according to the displacement of coercive authority by conscious argument,novel
"i've never heard of him, but i'll look him up. what do you think of him?",chit-chat
mr gabriel tarde 1890 in an original and fascinating study which has made an enduring impress on both psychological and sociological thought argues that the primordial social fact is imitation a phenomenon antecedent to all mutual aid division of labour and contract,novel
"i've never heard of him, but i'll look him up. what's the study about?",chit-chat
professor émile durkheim 1895 dissenting from the conclusions of m tarde undertakes to prove that the characteristically social process and therefore the ultimate social phenomenon is a coercion of every individual mind by modes of action thought and feeling that are external to itself p 14,novel
"i've never heard of émile durkheim, but i'll look him up. are you familiar with him?",chit-chat
according to giddings the original and elementary subjective fact in society is the consciousness of kind social psychology offers a vast and fertile field which has been but little worked and there was needed an introduction to the subject which should afford that general point of view which is the startingpoint of further studies,novel
that's interesting. i didn't know that social psychology was a branch of psychology.,chit-chat
this dr w mcdougall has attempted in a recently published little book,novel
what is the name of the little book? i'm familiar with dr. mcdougall.,chit-chat
108 his general conclusion is that the life of societies is not merely the sum of the activities of individuals moved by enlightened selfinterest or by intelligent desire for pleasure and aversion from pain but that the springs of all the complex activities that make up the life of societies must be sought in the instincts and in the other primary tendencies that are common to all men and are deeply rooted in the remote ancestry of the race,novel
"that's interesting. i'm not sure i follow what you're saying. what do you mean by "" the springs of all the complex activities that make up the life of societies must be sought in the instincts and in the other primary tendencies that are common to all men and are deeply rooted in the remote ancestry of the race?",chit-chat
professor e a ross of wisconsin simultaneously attacked the same subject on the problems of which he had previously written,novel
i've never heard of professor e. a ross of wisconsin. what subject did he attack?,chit-chat
109 sidenote magic and religion magic and religion are very generally held to be not only distinct from one another but antithetical,novel
that's true. it's interesting that there are so many different types of magic.,chit-chat
there is however a tendency among certain living students to regard them as analogous phenomena both being expressions of a belief in a power or energy which may be designated by the melanesian term mana or the american orenda it has more than once been pointed out that it is in some cases very hardperhaps impossibleto determine whether certain actions can be classed as either magical or religious as they appear to belong to both categories,novel
that's interesting. i don't think i've ever heard that term before.,chit-chat
as in the case of religion from the ethnological standpoint magic has been investigated in the field and immediate references to it are to be found in ethnological literaturethe comparative study of magic has to some extent been undertaken by frazer jevons and others but one of the most important contributions to the subject is by hubert and mauss110 who treat it from a sociological aspect,novel
"i've never heard of frazer jevons, but i'll have to check him out.",chit-chat
footnote 108 _an introduction to social psychology_ 1908,novel
have you ever heard of footnote 108? it's a song about social phobia.,chit-chat
footnote 109 _congress of arts and sci st louis_ 1904 v 1906 p 869,novel
have you ever been to st. louis? it's the most populous city in the state of missouri.,chit-chat
footnote 110 h hubert et m mauss esquisse dune théorie générale de la magie _lannée sociologique_ vii 1904,novel
do you like footnote? it's one of my favorite books of all time. it was published in 1937.,chit-chat
m mauss lorigine des pouvoirs magiques dans les sociétés australiennes _école pratique des haute études_ sec,novel
les pouvoirs magiques sont assez pratiques que les sociétés.,chit-chat
relig,novel
"i've never heard of relig before, but i'm familiar with it. do you know much about it?",chit-chat
1904,novel
have you ever been to new york city? it is the capital and largest city in the us.,chit-chat
sidenote anthropology and religion parson thwackum in _tom jones_ says when i mention religion i mean the christian religion and not only the christian religion but the protestant religion and not only the protestant religion but the church of england anthropology by a reverse process passes in larger sympathy from specific creeds to partake of the universal spirit which every creed tries to embody111 the interest of anthropology in religion was defined by huxley,novel
"i've never heard of sidenote anthropology, but it sounds interesting. do you know much about it?",chit-chat
112 anthropology has nothing to do with the truth or falsehood of religionit holds itself absolutely and entirely aloof from such questionsbut the natural history of religion and the origin and growth of the religions entertained by the different tribes of the human race are within its proper and legitimate province footnote 111 clodd _animism_ 1905 p 11,novel
i'm not sure what 112 anthropology has to do with the truth or falsehood of religionit.,chit-chat
footnote 112 address to dept,novel
have you ever been to footnote 112 address to dept? it's an address in the department of footnote.,chit-chat
of anthrop brit,novel
have you ever been to anthrop brit? it's an american animated television series.,chit-chat
ass,novel
have you ever been to the beach? it's a body of water that's been removed from the body of a human.,chit-chat
dublin 1878,novel
"have you ever been to dublin dublin? it's a dublin city in dublin, ireland.",chit-chat
this is not the place to attempt a definition of religiona task which has led to so many failures,novel
i'm sorry to hear that. what do you think is the place to try a definition of religiona task?,chit-chat
we must be content with the statement that it most frequently presents itself under the aspects of ritual myth and belief,novel
that's a good way to look at it. i think it's important to be content with the statement that it most often presents itself under the aspects of ritual myth and belief.,chit-chat
anthropology has hitherto practically confined its attention to ritual and myth and but too frequently exclusively to the last,novel
"i'm not familiar with anthropology, but i do know that it is the study of human behavior.",chit-chat
as andrew lang 1887113 points out in the sixth century bc,novel
i'm not familiar with him. what does he have to do with the 6th century bc?,chit-chat
xenophanes complained that the gods were credited with the worst crimes and other classical writers were shocked at the contradictions between the conception and ritual worship of the same god,novel
"i've never heard of xenophanes, but i'm familiar with him. what's the contradiction between the contradictions between the conception and ritual worship of the same god?",chit-chat
in ancient egypt the priests strove to shift the burden of absurdity and sacrilege from their own deities,novel
"wow, that's really interesting. i've never heard of a priest doing that before.",chit-chat
it taxed the ingenuity of pious brahmans to explain the myths which made indra the slayer of a brahman,novel
that's interesting. i've never heard of a slayer of a brahman before.,chit-chat
euhemerus 316 bc,novel
have you ever been to euhemus 316 bc? it's a great book.,chit-chat
in his philosophical romance _sacra historica_ in rationalising the fables about the gods was regarded as an atheist,novel
i'm not familiar with atheism. what does it mean to be an atheist?,chit-chat
certain writers like plutarch 60 ad and porphyry 270 ad made the ancient deities types of their own favourite doctrines whatever these might happen to be,novel
i've never heard of porphyry 270 ad. i'll have to check it out.,chit-chat
the early christians had a good case against the heathen,novel
i'm not sure what you're talking about. are you talking about the roman catholic church?,chit-chat
eusebius in the _præparatio evangelica_ anticipating andrew lang himself ridiculed with a good deal of humour the old theories which resolved so many mythical heroes into the sun p 20,novel
"i've never read eusebius, but i'm sure it's a great book.",chit-chat
the physical interpreters said eusebius do not even agree in their physical interpretations the light of the anthropological method had dawned on eusebius,novel
i'm not familiar with the anthropological method. can you tell me more about it?,chit-chat
many centuries later spencer master of corpus christi college cambridge 163093 had no other scheme in his mind in his erudite work on hebrew ritual114 which he considered was but an expurgated adaptation of heathen customs,novel
that's interesting. i've never heard of corpus christi before. what's it about?,chit-chat
fontenelle115 explained the irrational element in myth as inherited from savagery,novel
i've never heard of fontenelle115. what's his name?,chit-chat
footnote 113 1899 ed pp,novel
are you familiar with footnote 113? it is a collection of short stories written by footnote devs.,chit-chat
6 7,novel
have you ever heard of 6 7? it's a song by the same artist as 7 7.,chit-chat
footnote 114 _de legibus hebræorum ritualibus_ 1732,novel
"i've never heard of footnote, but i'm interested. what's it about?",chit-chat
footnote 115 _de lorigine des fables œuvres_ vol,novel
are you familiar with the footnote 115 des fables des œuvresone?,chit-chat
iii 1758,novel
"have you ever heard of 1757? it's from 1757, which is the year 1757.",chit-chat
the revival of learning made scholars acquainted with the religions not only of greece and rome but of the nations with whom the greeks and romans had come in contactegyptians semites persians and indians,novel
the revival of learning made scholars acquainted with the religions not only greece and rome but of the nations with whom the greeks and romans had come in contactegyptians semites persians and indians semites,chit-chat
