text,category
the project gutenberg ebook of history of anthropology this ebook is for the use of anyone anywhere in the united states and most other parts of the world at no cost and with almost no restrictions whatsoever,novel
i've never heard of the project gutenberg ebook. what's it about?,chit-chat
you may copy it give it away or reuse it under the terms of the project gutenberg license included with this ebook or online at wwwgutenbergorg,novel
that's a great idea! i'll have to look into that. thank you!,chit-chat
if you are not located in the united states you will have to check the laws of the country where you are located before using this ebook,novel
i am located in the us. i will have to check the laws of the country where i are located before using this ebook,chit-chat
title history of anthropology author alfred c haddon a hingston quiggin release date november 17 2023 ebook 72158 language english original publication london watts co 1910 credits peter becker and the online distributed proofreading team at httpswwwpgdpnet this file was produced from images generously made available by the internet archive last edit of project info start of the project gutenberg ebook history of anthropology illustration e b tylor,novel
i love the gutenberg ebook. it's my favorite ebook of all time.,chit-chat
history of anthropology by alfred c haddon ma scd frs fellow of christs college university reader in ethnology cambridge with the help of a,novel
have you ever read the history of anthropology by alfred c haddon ma scd frs?,chit-chat
hingston quiggin ma formerly of newnham college cambridge london watts co johnsons court fleet street ec4 printed in great britain by watts cojohnsons court fleet street london ec4 preface it is with great diffidence that we offer this little book to the public it being so far as we are aware the first attempt at a history of anthropology,novel
hingston quiggin ma formerly of newnham college cambridge london watts co johnsons court fleet fleet street ec4 printed in great britain by watts cojohnson court fleet street london ec4 preface it is with great diffidence that we offer this little book to the public it being so far as we are aware the first attempt at a history of anthropology,chit-chat
a book of small size which deals with so vast a subject comprising as it does so many different studies can not satisfy the specialists in the several departments,novel
a book of small size which deals with so vast a subject comprising as it does so many different studies can not satisfy the specialists in the several departments,chit-chat
in many branches the investigations are so recent that they can hardly be said to have a history and in some cases their originators are still alive,novel
that's true. it's a shame that they can't be said to have a history.,chit-chat
doubtless many will criticise the amount of space allocated to certain authors and wonder why others have been omitted or have received but scanty recognition,novel
that's a good point. i wonder if it has something to do with the fact that there are so many authors out there.,chit-chat
all we can say in extenuation for our selection is that the task has been by no means an easy one and we have partly been guided by the fact that our readers will mainly be of british nationality,novel
i'm sorry to hear that. i hope it's not too difficult for you.,chit-chat
it has been impossible to mention all of the more important of living workers whether investigators collectors or systematisers but this is not due to any lack of appreciation of their labours,novel
that's a good point. i'm not sure i'd want to work for someone who doesn't appreciate their labours.,chit-chat
in most cases references are given in the text a few supplemental works will be found in the bibliography at the end of the book,novel
that's a good way to look at it. i've never done that before.,chit-chat
the two dates which follow a name refer to the years of the individuals birth and death a single date refers to the date of publication of the book or memoir,novel
"that's interesting, i didn't know that. do you have a favorite book?",chit-chat
we hope we have in all cases referred to the authors to whom we are indebted for information and for personal assistance we desire to thank dr c s myers of gonville and caius college mr e e sikes tutor of st johns college cambridge and mr edward clodd,novel
that's very kind of you to do. i'm sure you'll be fine.,chit-chat
a c h _october 1910_ contents preface v introduction 15 _physical anthropology_ chapter i the pioneers of physical anthropology 627 definition of the word anthropology fundamental conceptions,novel
"i'm not familiar with anthropology, but i know that it is the study of human behavior.",chit-chat
race discrimination in bushman paintings in the art of ancient egypt assyria etc in vedic literature,novel
i'm not familiar with the art of ancient egypt assyria. do you know much about it?,chit-chat
hippocrates,novel
"hippocrates were the first species to be domesticated, and they have been around for thousands of years.",chit-chat
aristotle,novel
i'm a big fan of aristotle. he was the first person to be aristotle's best friend.,chit-chat
vesalius,novel
have you ever heard of vesalim? it's a latin word for man's best friend.,chit-chat
spigel,novel
have you ever owned a spigel dog? it's a small breed of dog.,chit-chat
tyson,novel
"tyson is my favorite tyson. he was born in tyson's hometown, new york city.",chit-chat
pygmies,novel
"i love pygmies! they are a group of small, furry, carnivorous animals.",chit-chat
linnæus,novel
"have you ever heard of linn? it's a latin word for "" land "".",chit-chat
buffon,novel
buffets are a great place to get buffets. they are a traditional italian dish consisting of a yeasted buffet.,chit-chat
blumenbach,novel
have you ever heard of blumenbach? it's an italian dish that was invented in italy.,chit-chat
monsters and wild men,novel
have you ever seen monsters and wild men? it's one of my favorite movies of all time.,chit-chat
chapter ii,novel
chapter ii is my favorite book of all time. it's the first book in the series.,chit-chat
the systematisers of physical anthropology 2849 craniology blumenbach the founder of craniology,novel
do you know anything about the systematisers of physical anthropology 2849 craniology blumenbach?,chit-chat
camper and the facial angel,novel
i love camper and the facial angel. it's my favorite movie of all time.,chit-chat
various early craniologists,novel
have you ever seen an early craniac? it's a group of animals that have been around for a long time.,chit-chat
retzius and the cephalic index,novel
retzius and the cephalic index are two of my favorite authors. do you like them?,chit-chat
grattan,novel
do you like grattan food? it's a traditional italian dish consisting of a yeasted flatbread.,chit-chat
broca,novel
have you ever been to a broca? it's a brotha's club.,chit-chat
topinard,novel
"i love toppings like vegetables, meats, and condiments. how about you?",chit-chat
de quatrefages,novel
have you ever heard of de quatage? it's a music festival in the united states.,chit-chat
virchow,novel
have you ever been to virchow? it's a restaurant that serves hot dogs and hot dogs.,chit-chat
sergi,novel
"i love sergi gi, it's my favorite animal. what's your favorite animal?",chit-chat
hagens and macalisters criticisms of craniometry,novel
i've never heard of hagens and macalisters. what's it about?,chit-chat
anthropometry white and others,novel
i love anthropometry! it's one of my favorite things to do. do you like it?,chit-chat
measurements and observations of living populations beddoe,novel
have you ever been to beddoe? it's the study of beddoe in the united states.,chit-chat
virchow,novel
have you ever been to virchow? it's a restaurant that serves hot dogs and hot dogs.,chit-chat
methods of dealing with anthropometrical data indices,novel
"i'm not sure what anthropometrical data indices are, but i do know that they're a form of math.",chit-chat
averages,novel
do you like to go to the gym? it's one of the most popular recreational activities in the world.,chit-chat
seriations,novel
have you ever had a serious episode of sleep deprivation? it's the worst.,chit-chat
curves,novel
"hello dear, do you know that the word "" cura "" is derived from the latin word cura?",chit-chat
mathematical treatment quetelet,novel
have you ever heard of quetted quetting? it's a quette that is used in mathematics.,chit-chat
galton,novel
"have you ever been to galton, new york? it's a city in new york city.",chit-chat
karl pearson,novel
karl karl ( karl karl karl ) is an american fashion designer. do you like karl karl?,chit-chat
scientific and practical value of anthropometry in the origin and differentiation of man,novel
what do you mean by scientific and practical value of anthropometry in the origin and differentiation of man?,chit-chat
racial history,novel
have you ever been to new york city? it's the most populous city in the us.,chit-chat
heredity,novel
have you ever heard of ity ity? it's a ity that refers to the ity of a person's abilities.,chit-chat
galton,novel
"have you ever been to galton, new york? it's a city in new york city.",chit-chat
miscegenation,novel
have you ever heard of miscegenation? it's a mental disorder where people misbehave.,chit-chat
the effect of the environment,novel
have you ever heard of the effect of the environment? it's an effect on the environment.,chit-chat
test of physical fitness,novel
have you ever been to the test of physical fitness? it's a test of fitness.,chit-chat
identification of criminals,novel
do you know anyone who is a criminal? i know a lot of people who are criminals.,chit-chat
bertillon,novel
have you ever heard of bertillin? it's a carnivorous animal.,chit-chat
galton,novel
"have you ever been to galton, new york? it's a city in new york city.",chit-chat
chapter iii,novel
do you like to read? it's one of my favorite books. it was published in 1937.,chit-chat
anthropological controversies 5069 origin of man,novel
do you know what anthropological sies are? they are the study of human behavior.,chit-chat
polygenism and monogenism,novel
have you ever heard of polygenism? it's the practice of abstaining from sin.,chit-chat
lawrence,novel
i've always wanted to learn how to play the violin. do you play any instruments?,chit-chat
lord monboddo,novel
have you ever heard of lord monboddo? he is an american singer and songwriter.,chit-chat
lamarck,novel
do you like lamarck? it's a traditional italian dish consisting of a yeasted flatbread.,chit-chat
cuvier,novel
have you ever heard of cucuculars? it's a group of people who work in the entertainment industry.,chit-chat
étienne sainthilaire,novel
have you ever heard of étienne sainthilie? it's a french french singer.,chit-chat
robert chambers _vestiges of creation_,novel
"have you ever heard of robert chambers? he's an english novelist, author, and author.",chit-chat
herbert spencer,novel
have you ever heard of herbert herbert? it's a herbert that's been around for a long time.,chit-chat
darwin _origin of species_,novel
have you ever heard of darwin's theory? it's a theory that rejects the existence of darwin.,chit-chat
the negros place in nature,novel
have you ever been to the negros place in nature? it's an american restaurant chain.,chit-chat
james hunt,novel
james hunt is one of my favorite comedians. have you ever heard of james james hunt?,chit-chat
chapter iv,novel
"do you like to read? i've been reading a lot of manga lately, and i'm really enjoying it.",chit-chat
the unfolding of the antiquity of man 7078 fossil man,novel
the unfolding of the antiquity of man 7078 fossil man is one of my favorite movies.,chit-chat
cannstadt neanderthal spy and other finds,novel
i've never heard of the cannstadt neanderthal spy. what does that entail?,chit-chat
_homo heidelbergensis homo primigenius pithecanthropus erectus_ chapter v comparative psychology 7987 phrenology,novel
i've never heard of primigenius pithecanthropus erectusl. what does that mean?,chit-chat
psychical research,novel
have you ever heard of psychophones? it's a form of psychotherapy.,chit-chat
methods and aims of psychology,novel
methods and aims of psychology is a great topic. it's one of my favorite topics.,chit-chat
ethnical psychology,novel
have you ever heard of ethnical psychology? it's a branch of psychology that deals with psychology.,chit-chat
bastian,novel
"have you ever heard of ian? he's an american singer, songwriter, and actor.",chit-chat
folk psychology,novel
have you ever listened to folk music? it's a genre of music that originated in the united states.,chit-chat
experimental psychology,novel
have you ever heard of experimental psychology? it's a branch of psychology that deals with human psychology.,chit-chat
eugenics,novel
eugenics are a group of instruments that are used to diagnose and treat illnesses.,chit-chat
chapter vi,novel
i'm a big fan of chapter vi. it's one of my favorite novels.,chit-chat
the classification and distribution of man 8898 race description and classification,novel
have you ever been to 8898 races? it is one of the most popular races in the world.,chit-chat
bernier,novel
i'm a bernier fan. he's one of the best goalkeepers in the world.,chit-chat
linnæus,novel
"have you ever heard of linn? it's a latin word for "" land "".",chit-chat
blumenbach,novel
have you ever heard of blumenbach? it's an italian dish that was invented in italy.,chit-chat
other classifications,novel
"what do you mean by classifications? i don't know much about them, but i do know that i'm not very good at them.",chit-chat
pruner bey,novel
have you ever heard of a pruner bey? it's a recording of a person's voice.,chit-chat
bory de s vincent,novel
have you ever been to bory's vincent? it's an american fashion house.,chit-chat
isidore geoffroy sainthilaire,novel
have you ever been to isidore geoffroy sainthilaire's wedding?,chit-chat
haeckel,novel
i've always wanted to learn how to use a ececkel. do you know much about it?,chit-chat
broca and topinard,novel
do you like toppings? broccoli is one of my favorite vegetables. do you?,chit-chat
flower,novel
my favorite flower is the flower of the flower family. it's a genus of flowers.,chit-chat
deniker,novel
do you like denikers? they are people who use a deniker to open a door.,chit-chat
keane,novel
keane is one of my favorite players of all time. he is such a great player.,chit-chat
mans place in nature,novel
have you ever been to man's place in nature? it's a great movie.,chit-chat
huxley,novel
"i've always wanted to get a huxley, but i'm afraid it's too expensive.",chit-chat
vogt,novel
"vogt is an american singer, songwriter, and actor. have you ever heard of him?",chit-chat
_cultural anthropology_ chapter vii,novel
are you a fan of anthropomorphic animals? i'm a huge fan of them.,chit-chat
ethnology its scope and sources 99110 definition,novel
"have you ever heard of ethnology? it's the study of the physical, mental, and spiritual aspects of human life.",chit-chat
sources,novel
i'm a big fan of the new york times. it's the world's most reliable source of information.,chit-chat
herodotus,novel
have you ever heard of dodotus? it's a medical term used to describe a person who has a mental illness.,chit-chat
lucretius,novel
"i'm not sure what that means, but i know it's an interesting word. do you know what it means?",chit-chat
strabo,novel
have you ever heard of strawbo? it's a type of animal that's been around for a long time.,chit-chat
travellers,novel
have you ever been to the united states? it's a sovereign state in north america.,chit-chat
missionaries,novel
have you ever been to the united states? it's a sovereign state in the united kingdom.,chit-chat
systematic works on ethnology,novel
have you ever heard of ethnology? it's a study of the human body.,chit-chat
prichard,novel
do you like icprichard? it's a soft drink made by pepsico.,chit-chat
other generalisations,novel
have you ever been in a situation where you were the only one in the room with the other person?,chit-chat
ethnology and the classics,novel
have you ever heard of ethnology? it's the study of the physical world.,chit-chat
ethnology and political science,novel
have you ever heard of ethnology? it's a branch of political science that i'm interested in.,chit-chat
chapter viii,novel
i'm a big fan of chapter 16. it's the first volume of the manga.,chit-chat
the history of archæological discovery 111125 prehistoric man,novel
i love the history of archæological discovery 111125 prehistoric man. do you?,chit-chat
flint implements,novel
"have you ever been to flint, michigan? it's a major city in the us.",chit-chat
denmark,novel
have you ever been to denmark? it's a nordic country located in the north atlantic ocean.,chit-chat
caves oreston,novel
have you ever been to the cave of oreston? it's a city in new york city.,chit-chat
kirkdale,novel
have you ever been to kkdale? it's an american city in north america.,chit-chat
liège,novel
i love lilians! they are a group of people who believe in the existence of lilianism.,chit-chat
kents cavern,novel
have you ever tried kents kents? it's an american distillation of kents.,chit-chat
lake dwellings,novel
have you ever been to lake lake? it's a lake in the southern united states.,chit-chat
irish crannogs,novel
have you ever heard of irish crannos? they are a group of irish people from ireland.,chit-chat
swiss pile dwellings,novel
"i've always wanted to go to switzerland, but i'm afraid it's too expensive.",chit-chat
brixham cave,novel
have you ever been to a brixham cave? it's a cave in the middle of nowhere.,chit-chat
boucher de perthes,novel
have you ever been to the boucher de perde? it's a french city in france.,chit-chat
subsequent progress of archæology,novel
have you ever been to archæology? it's a branch of the ancient greek archology.,chit-chat
france,novel
have you ever been to france? it's one of the most populous countries in the world.,chit-chat
britain,novel
have you ever been to the uk? it's a sovereign island nation in north america.,chit-chat
germany etc,novel
have you ever been to germany? it is the world's largest country in the world.,chit-chat
tertiary man,novel
"i've always wanted to be a man, but i'm not sure i could do it.",chit-chat
eoliths,novel
have you ever heard of eels? they are a type of grass - type pokemon.,chit-chat
chapter ix,novel
have you ever read chapter ix? it's one of my favorite non - fiction novels.,chit-chat
technology 126127 pittrivers,novel
have you ever heard of technology 126127 pittritritriology? it's a branch of the tech industry.,chit-chat
otis t mason,novel
have you ever heard of the t - t mason? he's an american fashion designer.,chit-chat
h balfour,novel
have you ever heard of balfour? it's a band that is based in new york city.,chit-chat
h colley march,novel
have you ever heard of the colley march? it's a music festival in new york city.,chit-chat
stolpe,novel
i'm a huge fan of pe - pe. it's a type of pe that's been around for a long time.,chit-chat
chapter x sociology and religion 128143 comparative ethnology,novel
i've never heard of ethnology before. are you familiar with the study of human behavior?,chit-chat
tylor,novel
have you ever been to tytyl? it's a latin word for tyrian.,chit-chat
avebury,novel
have you ever been to avebury? it's a small town in new york city.,chit-chat
sociology,novel
"hi, i'm interested in learning more about psychology. do you know much about it?",chit-chat
comte,novel
"i love comte's, they're my favorite food. what's your favorite comte?",chit-chat
buckle,novel
i've always wanted to learn how to swim. it's a type of herbivore.,chit-chat
herbert spencer,novel
have you ever heard of herbert herbert? it's a herbert that's been around for a long time.,chit-chat
bachofen morgan mclennan and others,novel
"bachofen morgan is an american singer, songwriter, and actor. do you like him?",chit-chat
magic and religion,novel
"have you ever heard of magic, religion, or magic? it's a lot of different things.",chit-chat
anthropology and religion,novel
do you know much about anthropology? it's a branch of religion that rejects the existence of god.,chit-chat
folklore,novel
i'm a big fan of folklore. it's a collection of animals and folklore.,chit-chat
comparative religion,novel
have you ever heard of religion? it's the practice of abstaining from sin.,chit-chat
chapter xi,novel
i'm a big fan of chapter 16. it's the first volume of the manga series.,chit-chat
linguistics 144148 the aryan controversy,novel
i'm not familiar with linguistics. what's the controversy about the aryan controversy?,chit-chat
language and race,novel
"do you speak any languages? i've always wanted to learn a language, but i'm not very good at it.",chit-chat
chapter xii,novel
i'm a big fan of chapter 12. it's the first volume of chapter 16.,chit-chat
cultural classification and the influence of 149152 environment gallatin,novel
"i'm not familiar with gallatin, but i do know that it's one of the oldest scientific disciplines in the world.",chit-chat
wilhelm von humboldt,novel
have you ever heard of the wilhelm von humhumps? it's a group of hummies that are armed with a gun.,chit-chat
hippocrates,novel
"hippocrates were the first species to be domesticated, and they have been around for thousands of years.",chit-chat
buffon,novel
buffets are a great place to get buffets. they are a traditional italian dish consisting of a yeasted buffet.,chit-chat
alexander von humboldt ritter and waitz,novel
"have you ever heard of waitz? he is an american singer, songwriter, and actor.",chit-chat
buckle,novel
i've always wanted to learn how to swim. it's a type of herbivore.,chit-chat
ratzel,novel
have you ever heard of a rat? they are a carnivorous mammal with a leathery armour shell.,chit-chat
reclus,novel
have you ever heard of reclus? it's an ancient greek word for water.,chit-chat
le play,novel
have you ever played le play? it's a video game where you play with friends.,chit-chat
retrospect 153 bibliography 155 index of authors 157 list of illustrations page e b tylor _frontispiece_ bushmen raiding kafir cattle 9 race portraiture of the ancient egyptians 10 j f blumenbach 24 upper and side views of skulls 29 paul broca 36 skull of the fossil man of la 74 chapelleauxsaints p w a bastian 83 j c prichard 105 introduction in his address to the anthropological section of the british association in 1892 professor alexander macalister made use of a little allegory to illustrate the growth and progress of anthropology,novel
"wow, that's a lot of work. do you have any other hobbies?",chit-chat
on an irregular and unfenced patch of waste land he said situated on the outskirts of a small town in which i spent part of my boyhood there stood a noticeboard bearing the inscription a free coup which when translated into the language of the southron conveyed the intimation rubbish may be shot here this place with its ragged mounds of unconsidered trifles the refuse of the surrounding households was the favourite playground of the children of the neighbourhood who found a treasury of toys in the broken tiles and oystershells the crockery and cabbagestalks which were liberally scattered round,novel
"wow, that's quite an interesting story. what did you do with the toys and oystershells?",chit-chat
passing by this place ten years later i found that its aspect had changed terraces of small houses had sprung up mushroomlike on the unsavoury foundation of heterogeneous refuse,novel
"wow, that's a long time ago. i'm glad it's over.",chit-chat
still more recently i notice that these in their turn have been swept away and now a large factory wherein some of the most ingenious productions of human skill are constructed occupies the site of the original waste here we may recognise the three stages in the progress of the science of anthropology,novel
that's interesting. i'm not familiar with anthropology. what do you know about it?,chit-chat
first a heap of heterogeneous facts and fancies the leavings of the historian of the adventurer of the missionarythe favourite playground of _dilettanti_ of various degrees of seriousness,novel
i'm not sure what you're talking about. are you talking about something else?,chit-chat
next we see order arising out of chaos and the buildingup of a number of superstructures bearing the signs of transitoriness and imperfection finally to be replaced by the solid fabric of a coherent whole,novel
that sounds like a lot of fun. what is your favorite thing to do in your free time?,chit-chat
in this little book some of the earlier builders on the scrapheap will be notedthe greek philosopher aristotle the belgian anatomist vesalius the englishmen tyson and prichard the swede linnaeus the frenchman buffon and the german blumenbach,novel
"i have never heard of notedthe greek philosopher aristotle, vesalius the belgian anatomist tyson and prichard the swede linnaeus the frenchman buffon and the german blumenbach",chit-chat
these laid the foundations of the science and each is claimed as the true founder of anthropology,novel
"what do you mean by "" the foundation of the science and each is claimed as the true founder of anthropology ""?",chit-chat
after these the workers become more numerous and more specialised and they will be dealt with under the separate headings of the various branches of the subject in which they laboured rather than in a continuous chronological order,novel
that's a good way to look at it. i'm not sure i agree with that.,chit-chat
meddling with questions of merit or priority is a thorny business at the best of times as huxley said and completeness is not here aimed at,novel
i don't think it's a thorny business at all. i'm not sure what you mean by that.,chit-chat
mention can be made only of those whose work notably contributed to or illustrates the historical growth of the science,novel
