text,category
between 1890 and 1896 he was stationed in java as surgeon to the dutch indian army and by order of the government he conducted some explorations with a view to determining the fossil fauna which had been discovered in those parts many years before,novel
"wow, that's really interesting. i've never heard of him before, but i know he was a surgeon.",chit-chat
while examining the beds attributed to the pleistocene period below the dry season level of the bengawan river at trinil he found the teeth calvarium and femur of the now worldfamous _pithecanthropus erectus_,novel
that's interesting. i'm not familiar with pithecanthropus erectus_.,chit-chat
this was announced even in scientific journals as the missing link found at last dubois published his account in java in 1894 and since that date a vast amount of literature has accumulated round the subject representing the three antagonistic points of view,novel
"wow, that's a long time ago. i'm sorry to hear about dubois.",chit-chat
some like virchow krause waldeyer ranke bumüller hamann and ten kate claim a simian origin for the remains turner cunningham keith lydekker rudolf martin and topinard believed them to be human while dubois manouvrier marsh haeckel nehring verneau schwalbe klaatsch and duckworth ascribe them to an intermediate form,novel
i've never heard of virchow krause waldeyer ranke and ten kate claim a simian origin for the remains turner cunningham keith lydekker rudolf martin and topinard believed them to be human while dubois manouvrier marsh haeckel nehring verneau schwalbe klaatsch and duckworth ascribe them to an intermediate form,chit-chat
the lastmentioned sums up the evidence in these words i believe that in _pithecanthropus erectus_ we possess the nearest likeness yet found of the human ancestor at a stage immediately antecedent to the definitely human phase and yet at the same time in advance of the simian stage57 footnote 57 the lowest term of the human series yet discovered is represented by pithecanthropus and dates from some part of the pleistocene epoch w j sollas _science progress_ 1908 p 353,novel
i'm not familiar with the lastmentioned. can you tell me more about it?,chit-chat
see also w volz _neues jahrb,novel
"i've never been to jahrb, but i'm sure it's a great place to visit.",chit-chat
f mineral_ 1907,novel
f mineralf 1907 is my favorite song. it's one of my favorite songs of all time. what's your favorite song?,chit-chat
the english as dr dubois somewhat slyly noted claimed the remains as human while the germans declared them to be simian he himself as a dutchman assigned them to a mixture of both,novel
that's interesting. i've never heard of him before. what does he do for a living?,chit-chat
the geological horizon in which the remains of _pithecanthropus erectus_ were discovered is still an open question,novel
"i don't know much about geology, but i do know that it is one of the oldest scientific theories.",chit-chat
of late opinion seems to tend towards regarding it as belonging to the early pleistocene instead of the pliocene to which it was at first referred,novel
i didn't know that. that's interesting. do you have a source for that?,chit-chat
58 after reviewing all the evidence concerning tertiary man professor sollas concludeswe have now reached the end of this summary and find ourselves precisely where we were having obtained no evidence either for or against the existence of man in times previous to the great ice age _loc,novel
i'm sorry to hear that. i hope you're able to get through it.,chit-chat
cit_ p 350,novel
have you ever been to the citcitre p 350? it's a car manufactured by citcitrus.,chit-chat
footnote 58 the terms magdalenian solutrian aurignacian mousterian acheulian chellian refer to various epochs of culture in palæolithic times giving their sequence from the newest to the most ancient,novel
i've never heard of the magdalenian numtrian. what is that?,chit-chat
these epochs are further subdivided by some investigators and several if not all of them are connected by intermediate stages,novel
"i'm not sure what you mean. what do you mean by "" some investigators ""?",chit-chat
in other words the remains prove that a steady evolution in culture has taken place,novel
i'm not sure what you mean by that. are you saying that the remains prove that a steady evolution in culture has taken place?,chit-chat
nowhere do all these layers occur in one locality and the evidence of their order is a matter of stratigraphy _ie_ it is essentially a geological method,novel
i'm not sure what you mean by that. are you referring to the fact that it is a geological method?,chit-chat
palæontology decides on the animal remains found in the beds,novel
"i've never heard of a palæontology, is it a medical field?",chit-chat
the human anatomist discusses the human remains and the archæologist deals with the artifacts or objects made by man,novel
the human anatomist talks about the human remains and the archæologist deals with the artifacts or objects made by man,chit-chat
the accurate determination of the order of the beds is obviously of fundamental importance,novel
i'm not sure i understand what you're saying. what do you mean by that?,chit-chat
the discovery of these human remains has had a very noticeable effect on anthropometry,novel
i'm not familiar with anthropometry. what is it that you're talking about?,chit-chat
most of them are imperfect some very much so as in the case for example of the partial calvaria of pithecanthropus and of the neanderthal specimen,novel
i have never heard of the partial calvaria of pithecanthropus. what is that?,chit-chat
the remains are of such intense interest that they stimulated anatomists to a more careful analysis and comparison with other human skulls and with those of anthropoids,novel
that's interesting. i've never heard of that. do you have a source?,chit-chat
as time rolled on new ways of looking at the problems suggested themselves which led to the employment of more elaborate methods of measurement or description,novel
that's a good way to look at it. i think i'm going to try that.,chit-chat
almost every specimen of fossil man has led to some improvement in technical research and the subject is not yet exhausted as the character of the inner walls of the crania have not yet yielded all their secrets more particularly in regard to the brains which they once protected,novel
that's interesting. i'm not familiar with the crania. what do you know about it?,chit-chat
it would be tedious to enumerate the names of those who have studied even the two calvaria just mentioned and impossible to record all of those who have advanced our knowledge of the anatomy of fossil man,novel
i don't think it would be that tedious. it's not like they'd have to do it all over again.,chit-chat
chapter v comparative psychology at the present time the data for a comparison of the bodily functions of the members of one race with those of another are so scanty that the science of ethnical physiology can scarcely be said to exist,novel
i've never heard of chapter v comparative psychology. i'll have to check it out.,chit-chat
fortunately there is a quite different state of affairs for the study of the mindor psychologythough even in this field there is yet a great deal of work to be done,novel
i've never heard of mindor psychologythough. what is it about? i'm not familiar with it.,chit-chat
during the eighteenth century the term anthropology which was very vaguely employed was often used to designate a comprehensive psychology dealing with the entire mental side of man as well as the relations between soul and body,novel
that's interesting. i've never heard of anthropology before. do you know much about it?,chit-chat
later as its scope became widened the centre of gravity shifted over to physical man but anthropologists have always maintained their right to deal also more or less with psychology,novel
that's interesting. i've never heard of anthropologists having a right to deal with psychology.,chit-chat
sidenote phrenology psychology in early times concerned itself with the essence of the soul as an independent entity its relations to the body its destructibility or indestructibility and the laws of its operations,novel
i have never heard of sidenote phrenology. is it a branch of psychology?,chit-chat
the word psychology has always had a vague and varying significance,novel
that's true. psychology is a branch of psychology that deals with the psychology of human behavior.,chit-chat
thus when hunt in his presidential address before the anthropological society in 1866 says i am glad to know that there are many fellows of this society who are at present working on the psychological aspects of our science he referred to the interest then taken by the members in the phrenology of the period,novel
i'm not familiar with the anthropological society in 1866. what is it about?,chit-chat
later on however he expresses his opinion with regard to modern phrenology as being wholly unscientific the old phrenology is now practically dead,novel
i don't think i've ever heard of phrenology. what's it about?,chit-chat
sidenote psychical research during the last quarter of the last century a study of various obscure mental states received a fresh impetus in this country by the founding of the society for psychical research,novel
that's interesting. i've never heard of sidenote psychical research before.,chit-chat
this society principally investigates 1 hypnotism disorders of personality automatic writing and crystalgazing which are universally recognised by psychologists as furnishing fields for scientific study and 2 thoughttransference and its manifestations which are not however at present generally accepted as facts,novel
"i've never heard of hypnotism disorder, but i'm familiar with crystalgazing.",chit-chat
though but recently crept forth _vix aut ne vix quidem_ from the chill shade of scientific disdain anthropology adopts the airs of her elder sisters among the sciences and is as severe as they to the cinderella of the family psychical research,novel
that's interesting. i've never heard of quideme before. what's her name?,chit-chat
she must murmur of her fairies among the cinders of the hearth while they go forth to the ball and dance with provincial mayors at the festivities of the british association,novel
she must murmur of her fairies among the cinders of the hearth while they go forth to the ball and dance with provincial mayors at the festivities of the british association,chit-chat
59 footnote 59 a lang _making of religion_ p 43,novel
"wow, that's a lot of footnote! what do you do for a living?",chit-chat
the hypnotic and kindred practices of the lower races have until lately scarcely attracted the attention of anthropologists,novel
i'm not familiar with the hypnotic or kindred practices. what is it?,chit-chat
bastian in 1890 wrote a tract _ueber psychische beobachtungen bei naturvölkern_ and tylor has also touched on the subject in _primitive culture_ but its main advocate is andrew lang who declares anthropology must remain incomplete while it neglects this field whether among wild or civilised men and in the course of time this will come to be acknowledged sidenote methods and aims if we turn now from popular to scientific notions of psychology we discern the following methods and aims of the science,novel
i'm not familiar with tylor's work. what do you know about him?,chit-chat
there are two methods1 the introspective by which ones own mental states are observed and 2 the objective by which the conduct of others is observed both may be studied without or under experimental conditions,novel
that's interesting. i've never heard of that before. do you have a source?,chit-chat
it is very difficult to secure reliable introspection in backward peoples and also to interpret the mental state of an individual by observing his behaviour,novel
it is very difficult to secure reliable introspection in backwards peoples and also to interpret the mental state of an individual by observing his behavior,chit-chat
the objects of psychology are fivefold 1,novel
i'm not sure what you mean by that. are you referring to the objects of psychology that are fivefold 1?,chit-chat
the study of mind compared with nonmental processes,novel
the study of mind compared to nonmental processes is a very interesting topic. do you know anything about it?,chit-chat
2,novel
do you have a favorite color? mine is yellow. it's the color between green and orange.,chit-chat
the study of the mind of the individual compared with other minds,novel
the study of the mind of the individual compared with other minds. what do you mean by that?,chit-chat
3,novel
i love the color blue. it's one of the three primary colors. what's your favorite color?,chit-chat
the study of the normal mind of the individual compared with the abnormal,novel
i'm not sure what you mean. are you talking about the study of the normal mind?,chit-chat
4,novel
i've been trying to figure out what the heck is going on. i'm not sure what to expect.,chit-chat
the study of the mind of one race compared with that of other races,novel
i'm not sure what you mean. are you talking about the study of the mind of one race?,chit-chat
5,novel
do you have a favorite color? mine is green. it's the color of my hair.,chit-chat
the study of the mind of genus homo compared with that of animals,novel
i'm not sure what you mean. are you referring to the study of the mind of genus homo compared to animals?,chit-chat
all these are of interest and value for anthropology especially the second fourth and fifth,novel
"i'm not sure what anthropology is, but i know it's the study of human history.",chit-chat
in the earlier days of psychology when the subject was in the leadingstrings of philosophy it had little ethnological value,novel
i'm not familiar with psychology. what do you think is ethnological value for philosophy?,chit-chat
indeed the possibility of such a subject as ethnological psychology was not realised,novel
ethnological psychology is a very interesting subject. i'm not sure i've ever thought about it before.,chit-chat
sidenote ethnical psychology ethnical psychology the study of the mind of other races and peoples of which among the more backward races glimpses can be obtained only by living among them and endeavouring to reach their point of view by means of observation and experiment is a modern conception and for this branch of the subject there is no history,novel
"i've never heard of sidenote ethnical psychology, is it a branch of psychology?",chit-chat
as an illustration of the change of attitude with regard to ethnical psychology during the last fifty years we may quote from burmeister60 in 1853 it is not worth while to look into the soul of the negro,novel
i'm not familiar with burmeister60. what does he say about ethnical psychology?,chit-chat
it is a judgment of god which is being executed that at the approach of civilisation the savage man must perish and again61 in 1857 i have often tried to obtain an insight into the mind of the negro but it was never worth the trouble compare with this such works as r e dennetts _at the back of the black mans mind_ 1906,novel
i don't think i've ever heard of r e dennetts. what does he do?,chit-chat
in justification of his attempt to represent the basal ideas of the west african native dennett says i can not help feeling that one who has lived so long among the africans and who has acquired a kind of way of thinking black should be listened to on the offchance that a secondary instinct developed by long contact with the people he is writing about may have driven him to a right or very nearly right conclusion pp,novel
i'm not familiar with the west african native dennett. what's his name?,chit-chat
1334,novel
have you ever heard of 3334? it's a song by the same artist.,chit-chat
and as the keynote of his elaborate investigation which results in crediting the africans with thoughts concerning their religious and political system comparable to any that may have been handed down to ourselves by our own ancestors he quotes from flora l shaw62 it may happen that we shall have to revise entirely our view of the black races and regard those who now exist as the decadent representatives of an almost forgotten era rather than as the embryonic possibility of an era yet to come footnote 60 _der schwarze mensch_ footnote 61 _reise nach brasilien_ footnote 62 flora l shaw lady lugard _a tropical dependency_ p 17,novel
i'm not familiar with shaw62. what does he say about african - americans?,chit-chat
the earliest recognition of the anthropological aspect of psychology is found in germany where bastian was always insisting on the essential connection between psychology and ethnology and although his own literary method was peculiarly obscure he did a very great deal both by his writings and personal influence to stimulate the study of psychology from the point of view of ethnology,novel
"i'm not familiar with bastian's methods, but i do know that ethnology is a branch of psychology.",chit-chat
illustration p w a bastian,novel
are you familiar with illustration p w / a bastian? it's a japanese art form.,chit-chat
sidenote bastian sidenote folk psychology adolf bastian 18261905 after passing through five universitiesheidelberg berlin jena wurzburg and praguebegan his life of travel in 1851 as a ships doctor,novel
i'm sorry to hear that. i hope you're doing well in your life.,chit-chat
the next twentyfive years were mainly spent in voyages of research in all parts of the world and always with one object in viewthe collection of materials for a comparative psychology on the principles of a natural science,novel
that sounds like a lot of fun. what do you like to do in your spare time?,chit-chat
his first journey which occupied eight years resulted in the publication in 1860 of the first of a long series of writings,novel
"wow, that's a long time. i've never read any of his books.",chit-chat
when not engaged in travel his life was filled with his work in connection with the berlin museums,novel
that's really interesting. i've never heard of the berlin museums. what do you know about them?,chit-chat
great though these services were bastians main interest was always concentrated on psychology,novel
that's true. it's hard to believe that people have been doing this for so long.,chit-chat
the ideas of folk psychology were in the air and the study of _weltanschauung_ or to use bastians phrase _völkergedanken_ was already inaugurated in germany,novel
"i'm not familiar with the german phrase "" völkergedanken_ "". what does it mean?",chit-chat
to organise this study by introducing wide scientific inductive and comparative methods and to collect evidence from among all the peoples of the earth was bastians lifework in which he was still engaged when death overtook him at trinidad in 1905,novel
that's interesting. i've never heard of bastians lifework before.,chit-chat
among the conceptions of the _naturvölker_the cryptograms of mankind as he called themhe worked unceasingly demonstrating first the surprising uniformity of outlook on the part of the more primitive peoples and secondly the correlation of differences of conceptions with differences in material surroundings varying with geographical conditions,novel
i've never heard of this cryptogram before. what does it stand for?,chit-chat
this second doctrine he elaborated in his _zur lehre von den geographischen provinzen_ in 1886,novel
that's interesting. i've never heard of him before. what's his name?,chit-chat
the term psychology of peoples has become familiar of late and books have been written on the psychology of special peoples such as the _esquisse psychologique des peuples européens_ 1903 by a fouillée but these are based on general considerations and not on experimental evidence,novel
i've never heard of the esquisse psychologique. what is it about?,chit-chat
the place of comparative psychology in anthropology was officially determined in this country by the request which the anthropological institute made to herbert spencer in 1875 to map out the comparative psychology of man with a view to providing some sort of method in handling the various questions that came before the institute,novel
"i've never heard of anthropological institute, but i'll look into it.",chit-chat
the result of this was spencers provisional scheme of character in which the problem of measurement took an important place,novel
i've never heard of spencers provisional scheme of character. what's that?,chit-chat
sidenote experimental psychology in the department of experimental psychology germany again took the lead,novel
that's interesting. i'm not familiar with that field. what is it about?,chit-chat
g t fechner63 attempted by means of laboratory tests to discover the law of connection between psychical and bodily events,novel
g t fechner63 attempted by means of lab tests to discover the law of connection between psychical and bodily events,chit-chat
a band of workers arose and the new science spread to other countries,novel
that's interesting. do you have a source for that information? i'm interested.,chit-chat
in our country sir francis galton took advantage of the international health exhibition at london 1884 to install in the exhibition an anthropometric laboratory in which a few psychological experiments were made on a large number of people and since then he has frequently made arrangements for similar laboratories,novel
"wow, that's interesting. i've never heard of sir francis galton before.",chit-chat
footnote 63 _elemente der psychophysik_ 1860,novel
have you ever heard of footnote 63? it's a song by the psychophysik.,chit-chat
in nearly all of the larger universities experimental psychology is a recognised study and almost every variety of mental condition is investigated,novel
do you have a source for that? i'm interested in learning more about mental disorders.,chit-chat
professor w wundt in his _völkerpsychologie_ 1904 has been a masterbuilder on these foundations,novel
that's interesting. i've never heard of him before. what does he build?,chit-chat
the experiments in psychological laboratories were of necessity confined to subjects readily accessible who naturally were mainly europeans or of european descent,novel
that's interesting. do you have a source for that? i'm interested in learning more.,chit-chat
a few observations had been made on aliens who as a rule had been brought from their native countries for show purposes but in these cases the observations were made under unfavourable conditions so far as the subject was concerned,novel
that's interesting. i've never heard of that before. have you heard anything about it?,chit-chat
with the exception of these very few and unsatisfactory investigations experimental psychology was mainly concerned with the subjects numbered 2 3 and 5 in the table on p 81,novel
that's interesting. i'm not familiar with p 81. what's it about?,chit-chat
a new departure was made in 1898 by the cambridge anthropological expedition to torres straits,novel
that's really cool. i've never been there before. what did you do there?,chit-chat
for the first time trained experimental psychologists drs,novel
i'm sorry to hear that. i hope you're doing better now. are you feeling better now?,chit-chat
w h r rivers w mcdougall and c s myers investigated by means of an adequate laboratory equipment a people in a low stage of culture under their ordinary conditions of life,novel
"i'm not familiar with w h r rivers, but i know he's an american singer.",chit-chat
the foundations of ethnical experimental psychology were thus laid,novel
i've never heard of ethnical experimental psychology. is it a branch of psychology?,chit-chat
professor r w woodworth sums up the conclusions arrived at from his own observations and those of others as follows we are probably justified in inferring that the sensory and motor processes and the elementary brain activities though differing in degree from one individual to another are about the same from one race to another64 footnote 64 _science_ xxxi 1910 p 179,novel
i'm not familiar with r w woodworth. what does he say about sensory and motor processes?,chit-chat
lately an attempt has been made under the auspices of the royal anthropological institute to provide travellers with instructions for psychological investigations in the field,novel
that sounds like a lot of fun. i'd like to visit one of their facilities one day.,chit-chat
sidenote eugenics during the last few years the subject of race improvement or eugenics has been greatly to the fore and it has been in this country mainly connected with the name of sir francis galton who as long ago as 1865 published his views on the subject,novel
i have never heard of sir francis galton. what is his view on eugenics?,chit-chat
eugenics is officially defined in the minutes of the university of london as the study of agencies under social control that may improve or impair the racial qualities of future generations either physically or mentally a eugenics laboratory has recently been established in university college london in connection with professor karl pearsons biometric laboratory,novel
"i've never heard of a eugenics lab, but i'll look into it.",chit-chat
chapter vi,novel
i'm a big fan of chapter vi. it's one of my favorite novels.,chit-chat
the classification and distribution of man sidenote race description and classification after the age of race discrimination comes the age of race description and classification and as we should expect this second stage is not reached until the close of the dark ages and the dawn of the renaissance when thought had been emancipated from the bondage of scholastic authority and stimulated by the new impulse which infected all forms of intellectual activity,novel
