text,category
"yes, it was very frightful. i'm glad he's doing better now.",chit-chat
it was as if he had been clipped at every joint,novel
that's what i was thinking. i'm glad he's doing so well.,chit-chat
he fell in a little heap,novel
i'm sorry to hear that. i hope he's ok. what did he do?,chit-chat
the sound came steadily nearer and in advance of it came this ghastly thought the crocodile is about to board the ship even the iron claw hung inactive as if knowing that it was no intrinsic part of what the attacking force wanted,novel
"wow, that's scary. i hope you didn't hurt the crocodile too much.",chit-chat
left so fearfully alone any other man would have lain with his eyes shut where he fell but the gigantic brain of hook was still working and under its guidance he crawled on the knees along the deck as far from the sound as he could go,novel
"wow, that's pretty intense. i'm not sure if i could do that.",chit-chat
the pirates respectfully cleared a passage for him and it was only when he brought up against the bulwarks that he spoke,novel
that's cool. i've never been a big fan of the bulwarks.,chit-chat
hide me he cried hoarsely,novel
i'm sorry to hear that. what did he do to make you feel that way?,chit-chat
they gathered round him all eyes averted from the thing that was coming aboard,novel
that's a good way to look at it. i'm glad he didn't get hurt.,chit-chat
they had no thought of fighting it,novel
that's what i'm thinking. i don't know what to do about it.,chit-chat
it was fate,novel
"i'm not sure what that means, but i know it's a good movie.",chit-chat
only when hook was hidden from them did curiosity loosen the limbs of the boys so that they could rush to the ships side to see the crocodile climbing it,novel
"wow, that's really interesting. i didn't know there was a crocodile on the ship side.",chit-chat
then they got the strangest surprise of the night of nights for it was no crocodile that was coming to their aid,novel
"oh no, that's terrible. i'm sorry you had to go through that.",chit-chat
it was peter,novel
i love peter! he's my favorite character. what's your favorite peter character?,chit-chat
he signed to them not to give vent to any cry of admiration that might rouse suspicion,novel
that's a good way to look at it. i'm glad he didn't do that.,chit-chat
then he went on ticking,novel
"i'm not sure what that means, but i don't know what it means.",chit-chat
chapter xv,novel
i'm a big fan of chapter chapter. it's a collection of chapters that take place in the past.,chit-chat
hook or me this time odd things happen to all of us on our way through life without our noticing for a time that they have happened,novel
hook or me is a great movie. it's one of my favorites. have you seen it?,chit-chat
thus to take an instance we suddenly discover that we have been deaf in one ear for we dont know how long but say half an hour,novel
"wow, that must have been nerve wracking. did you have to go to the doctor?",chit-chat
now such an experience had come that night to peter,novel
what happened to peter? i haven't seen him in a long time. what happened?,chit-chat
when last we saw him he was stealing across the island with one finger to his lips and his dagger at the ready,novel
"oh wow, i didn't see that. what did he do? did he steal anything?",chit-chat
he had seen the crocodile pass by without noticing anything peculiar about it but by and by he remembered that it had not been ticking,novel
that's really interesting. did you find out who it was? did you catch it?,chit-chat
at first he thought this eerie but soon concluded rightly that the clock had run down,novel
that's pretty cool. did you find out who it was at the end of the day?,chit-chat
without giving a thought to what might be the feelings of a fellowcreature thus abruptly deprived of its closest companion peter began to consider how he could turn the catastrophe to his own use and he decided to tick so that wild beasts should believe he was the crocodile and let him pass unmolested,novel
"wow, that's interesting. i've never heard of a crocodile before. what kind of crocodile is it?",chit-chat
he ticked superbly but with one unforeseen result,novel
that's awesome! i'm so happy for him. i hope he's doing well in the future.,chit-chat
the crocodile was among those who heard the sound and it followed him though whether with the purpose of regaining what it had lost or merely as a friend under the belief that it was again ticking itself will never be certainly known for like slaves to a fixed idea it was a stupid beast,novel
that's interesting. i didn't know that. do you have a source for that?,chit-chat
peter reached the shore without mishap and went straight on his legs encountering the water as if quite unaware that they had entered a new element,novel
"hello, peter. how are you doing today? i hope you are doing well, peter!",chit-chat
thus many animals pass from land to water but no other human of whom i know,novel
i'm sorry to hear that. do you know any animals that pass from land to water?,chit-chat
as he swam he had but one thought hook or me this time he had ticked so long that he now went on ticking without knowing that he was doing it,novel
that's pretty cool. i'm glad he didn't think he was doing it.,chit-chat
had he known he would have stopped for to board the brig by help of the tick though an ingenious idea had not occurred to him,novel
i don't think so. i think he just didn't know what to do.,chit-chat
on the contrary he thought he had scaled her side as noiseless as a mouse and he was amazed to see the pirates cowering from him with hook in their midst as abject as if he had heard the crocodile,novel
that's pretty cool. i've never seen a crocodile before. what kind of crocodile is it?,chit-chat
the crocodile,novel
the crocodile is one of my favorite animals. it's one of the first species to be domesticated.,chit-chat
no sooner did peter remember it than he heard the ticking,novel
i don't think so. i'm pretty sure he didn't hear it.,chit-chat
at first he thought the sound did come from the crocodile and he looked behind him swiftly,novel
that's pretty cool. i'm glad he didn't get hurt too bad.,chit-chat
then he realised that he was doing it himself and in a flash he understood the situation,novel
that's a good way to look at it. i'm glad he learned his lesson.,chit-chat
how clever of me he thought at once and signed to the boys not to burst into applause,novel
that's really smart of him. i'm sure he didn't know what he was doing.,chit-chat
it was at this moment that ed teynte the quartermaster emerged from the forecastle and came along the deck,novel
that's so cool! did you get to see the quartermaster's face when you saw him?,chit-chat
now reader time what happened by your watch,novel
i'm not sure if i should get it back or not. i don't know what to do.,chit-chat
peter struck true and deep,novel
peter is such a great actor. he's one of the best in the history of movies.,chit-chat
john clapped his hands on the illfated pirates mouth to stifle the dying groan,novel
i'm not familiar with john. what does he do for a living? is he a pirate?,chit-chat
he fell forward,novel
that's what i'm talking about. i don't understand why he fell forward.,chit-chat
four boys caught him to prevent the thud,novel
that's a good way to look at it. i'm glad they caught him.,chit-chat
peter gave the signal and the carrion was cast overboard,novel
i'm not familiar with peter. what's the signal you're referring to?,chit-chat
there was a splash and then silence,novel
that's pretty cool. i'm glad you were able to get out of there.,chit-chat
how long has it taken,novel
it took about a week and a half. it's been a long time since i've done it.,chit-chat
one slightly had begun to count,novel
"oh, that's a bummer. i'm sorry to hear that. what happened?",chit-chat
none too soon peter every inch of him on tiptoe vanished into the cabin for more than one pirate was screwing up his courage to look round,novel
that's pretty funny. i'm not sure what you're trying to say.,chit-chat
they could hear each others distressed breathing now which showed them that the more terrible sound had passed,novel
that's interesting. i've never heard that before. do you know what caused it?,chit-chat
its gone captain smee said wiping off his spectacles,novel
that's too bad. i hope smee can find a way to make it back.,chit-chat
alls still again slowly hook let his head emerge from his ruff and listened so intently that he could have caught the echo of the tick,novel
that's a good way to look at it. i'm glad he's doing well.,chit-chat
there was not a sound and he drew himself up firmly to his full height,novel
"oh wow, that's scary. i hope he didn't get hurt too bad.",chit-chat
then heres to johnny plank he cried brazenly hating the boys more than ever because they had seen him unbend,novel
that's so sad. i'm sorry to hear that. what happened to him?,chit-chat
he broke into the villainous ditty yo ho yo ho the frisky plank you walks along it so till it goes down and you goes down to davy jones below to terrorise the prisoners the more though with a certain loss of dignity he danced along an imaginary plank grimacing at them as he sang and when he finished he cried do you want a touch of the cat before you walk the plank at that they fell on their knees,novel
"i'm not sure what you're trying to say, but i don't get it.",chit-chat
no no they cried so piteously that every pirate smiled,novel
i'm sorry to hear that. i hope you're able to get over it.,chit-chat
fetch the cat jukes said hook its in the cabin the cabin,novel
that's a good idea. i'll have to do that. do you have a cat?,chit-chat
peter was in the cabin,novel
peter was in the cabin? i've never seen that movie. what was it about?,chit-chat
the children gazed at each other,novel
i've had that happen to me a few times. it's not fun at all.,chit-chat
ay ay said jukes blithely and he strode into the cabin,novel
"hello, how are you doing today? i just got back from a long day at work.",chit-chat
they followed him with their eyes they scarce knew that hook had resumed his song his dogs joining in with him yo ho yo ho the scratching cat its tails are nine you know and when theyre writ upon your back what was the last line will never be known for of a sudden the song was stayed by a dreadful screech from the cabin,novel
"oh my god, i can't believe i've never heard of this song before.",chit-chat
it wailed through the ship and died away,novel
i'm so sorry to hear that. i hope you're ok. what happened?,chit-chat
then was heard a crowing sound which was well understood by the boys but to the pirates was almost more eerie than the screech,novel
"wow, that's pretty scary. i'm glad you were able to get out of there.",chit-chat
what was that cried hook,novel
"i don't know what it is, but i can't stop listening to it.",chit-chat
two said slightly solemnly,novel
i'm not sure what you mean by that. are you saying that you don't like them?,chit-chat
the italian cecco hesitated for a moment and then swung into the cabin,novel
that's so funny! i've never heard of the italian cecco before. what's his name?,chit-chat
he tottered out haggard,novel
he tottered out haggard? i don't know much about haggards.,chit-chat
whats the matter with bill jukes you dog hissed hook towering over him,novel
"i don't know about you, but i'm not a fan of bill jukes.",chit-chat
the matter wi him is hes dead stabbed replied cecco in a hollow voice,novel
that's so sad. i don't think i'll ever be able to live without him.,chit-chat
bill jukes dead cried the startled pirates,novel
i'm so sorry to hear that. bill jukes dead cried about the startled pirates.,chit-chat
the cabins as black as a pit cecco said almost gibbering but there is something terrible in there the thing you heard crowing the exultation of the boys the lowering looks of the pirates both were seen by hook,novel
that's awful. i'm so sorry to hear that. i hope you're okay.,chit-chat
cecco he said in his most steely voice go back and fetch me out that doodledoo cecco bravest of the brave cowered before his captain crying no no but hook was purring to his claw,novel
i've never heard of doodledoo before. what's his name?,chit-chat
did you say you would go cecco he said musingly,novel
no i didn't. i'm not sure what i want to do with my life.,chit-chat
cecco went first flinging his arms despairingly,novel
i don't think i've ever seen him do that. what did he do?,chit-chat
there was no more singing all listened now and again came a deathscreech and again a crow,novel
oh no! that's terrible! i hope you're able to get over it.,chit-chat
no one spoke except slightly,novel
i'm sorry to hear that. have you ever been in a situation like that before?,chit-chat
three he said,novel
"wow, that's a lot of work. i'm not sure i could do that.",chit-chat
hook rallied his dogs with a gesture,novel
i've never heard of hook rallied dogs before. what kind of dogs do you have?,chit-chat
sdeath and odds fish he thundered who is to bring me that doodledoo wait till cecco comes out growled starkey and the others took up the cry,novel
i'm sorry to hear that. i hope you're able to get over it.,chit-chat
i think i heard you volunteer starkey said hook purring again,novel
i'm not sure what you're talking about. what was the hook purring about?,chit-chat
no by thunder starkey cried,novel
"i've never heard of thunder starkey, what's it about? do you like them?",chit-chat
my hook thinks you did said hook crossing to him,novel
that's a good way to look at it. what kind of hooks do you use?,chit-chat
i wonder if it would not be advisable starkey to humour the hook ill swing before i go in there replied starkey doggedly and again he had the support of the crew,novel
i'm not familiar with starkey. what's his name? i've never heard of him.,chit-chat
is this mutiny asked hook more pleasantly than ever,novel
i don't think so. i think it's a little too much for me.,chit-chat
starkeys ringleader captain mercy starkey whimpered all of a tremble now,novel
"starkey ringleader, captain mercy starkey whimpered all of of a tremble now",chit-chat
shake hands starkey said hook proffering his claw,novel
shake hands starkey said the hook proffered his claw? i don't get it.,chit-chat
starkey looked round for help but all deserted him,novel
"starkey looked round to help, but he didn't want to help. starkey was the only one who could help.",chit-chat
as he backed up hook advanced and now the red spark was in his eye,novel
that's pretty cool. i've never seen a hook advanced before. what's the name of the hook advanced?,chit-chat
with a despairing scream the pirate leapt upon long tom and precipitated himself into the sea,novel
"oh my god, that's so scary! i'm so sorry to hear that.",chit-chat
four said slightly,novel
i'm not sure what you mean by that. are you referring to the number 4?,chit-chat
and now hook said courteously did any other gentlemen say mutiny seizing a lantern and raising his claw with a menacing gesture ill bring out that doodledoo myself he said and sped into the cabin,novel
that sounds like a lot of fun. i'm sure you'll have a great time.,chit-chat
five how slightly longed to say it,novel
i'm not sure what you're talking about. are you talking about something else?,chit-chat
he wetted his lips to be ready but hook came staggering out without his lantern,novel
"wow, that's pretty impressive. i'm glad he didn't get hurt.",chit-chat
something blew out the light he said a little unsteadily,novel
what did he say? i'm not sure what you mean by something blew out the light.,chit-chat
something echoed mullins,novel
"i'm not sure what that means, but it sounds interesting. what do you think?",chit-chat
what of cecco demanded noodler,novel
"i don't know what that means, but i'm not sure what it means.",chit-chat
hes as dead as jukes said hook shortly,novel
what did jukes say? i don't know much about the history of jukes.,chit-chat
his reluctance to return to the cabin impressed them all unfavourably and the mutinous sounds again broke forth,novel
that's pretty cool. i've never been in a cabin before. what kind of cabin was it?,chit-chat
all pirates are superstitious and cookson cried they do say the surest sign a ships accurst is when theres one on board more than can be accounted for ive heard muttered mullins he always boards the pirate craft last,novel
i've never heard that before. i'll have to check it out. do you have a favorite type of pirate?,chit-chat
had he a tail captain they say said another looking viciously at hook that when he comes its in the likeness of the wickedest man aboard had he a hook captain asked cookson insolently and one after another took up the cry the ships doomed at this the children could not resist raising a cheer,novel
i've never heard of a hook captain before. what does he do for a living?,chit-chat
hook had wellnigh forgotten his prisoners but as he swung round on them now his face lit up again,novel
that's pretty cool. i've never heard of hook before. what's his name?,chit-chat
lads he cried to his crew now heres a notion,novel
i'm sorry to hear that. i hope he's feeling better now. what did he cry about?,chit-chat
open the cabin door and drive them in,novel
that's a good idea. i'll have to do that when i get home.,chit-chat
let them fight the doodledoo for their lives,novel
that's a good idea. i think i'm going to have to do that.,chit-chat
if they kill him were so much the better if he kills them were none the worse for the last time his dogs admired hook and devotedly they did his bidding,novel
that's a good point. i'm not sure if i'd want to kill him.,chit-chat
the boys pretending to struggle were pushed into the cabin and the door was closed on them,novel
that's so sad. i'm sorry you had to go through that. what happened?,chit-chat
now listen cried hook and all listened,novel
i'll have to check it out. what's the name of the song you're talking about?,chit-chat
but not one dared to face the door,novel
that's what i'm saying. i don't know what to do with myself.,chit-chat
yes one wendy who all this time had been bound to the mast,novel
"i'm not sure what that means, but i hope it's a good one.",chit-chat
it was for neither a scream nor a crow that she was watching it was for the reappearance of peter,novel
"oh, that's interesting. what did she do to make you think she was watching it?",chit-chat
she had not long to wait,novel
that's a bummer. i'm sorry to hear that. what did she do?,chit-chat
in the cabin he had found the thing for which he had gone in search the key that would free the children of their manacles and now they all stole forth armed with such weapons as they could find,novel
"wow, that's pretty scary. did you find out who it was or did you have to call the police?",chit-chat
first signing them to hide peter cut wendys bonds and then nothing could have been easier than for them all to fly off together but one thing barred the way an oath hook or me this time so when he had freed wendy he whispered for her to conceal herself with the others and himself took her place by the mast her cloak around him so that he should pass for her,novel
i'm sorry to hear that. i hope you're able to find someone else.,chit-chat
then he took a great breath and crowed,novel
that's what i was thinking. i'm glad he didn't get hurt.,chit-chat
to the pirates it was a voice crying that all the boys lay slain in the cabin and they were panicstricken,novel
that's so sad. i'm sorry to hear that. i hope you're ok.,chit-chat
hook tried to hearten them but like the dogs he had made them they showed him their fangs and he knew that if he took his eyes off them now they would leap at him,novel
that's really interesting. i've never heard of hook before. what's his name?,chit-chat
lads he said ready to cajole or strike as need be but never quailing for an instant ive thought it out,novel
i'm sorry to hear that. do you think you're going to be ok?,chit-chat
theres a jonah aboard ay they snarled a man wi a hook no lads no its the girl,novel
i'm not sure what you're saying. are you saying it's a boy or a girl?,chit-chat
never was luck on a pirate ship wi a woman on board,novel
i'm sorry to hear that. have you ever been on a ship with a woman on board?,chit-chat
well right the ship when shes gone some of them remembered that this had been a saying of flints,novel
that's a good point. it's hard to remember things like that when you're so young.,chit-chat
its worth trying they said doubtfully,novel
that's good to hear. i'm not sure if it's worth it.,chit-chat
fling the girl overboard cried hook and they made a rush at the figure in the cloak,novel
that's so sad. i'm sorry to hear that. what did you do?,chit-chat
theres none can save you now missy mullins hissed jeeringly,novel
i don't think i've ever heard of missy mullins. what is she?,chit-chat
theres one replied the figure,novel
i've seen that one. it's pretty cool. i'm looking forward to seeing it.,chit-chat
whos that peter pan the avenger came the terrible answer and as he spoke peter flung off his cloak,novel
i don't know who peter pan the avenger is. what answer did he say?,chit-chat
then they all knew who twas that had been undoing them in the cabin and twice hook essayed to speak and twice he failed,novel
that's what i was thinking. i'm glad he didn't get caught.,chit-chat
in that frightful moment i think his fierce heart broke,novel
i know right? i can't even imagine what it must have been like to have to go through that.,chit-chat
at last he cried cleave him to the brisket but without conviction,novel
i'm sorry to hear that. i hope he's able to get over it.,chit-chat
down boys and at them peters voice rang out and in another moment the clash of arms was resounding through the ship,novel
i've never heard of down boys before. what's it like to be on a ship?,chit-chat
had the pirates kept together it is certain that they would have won but the onset came when they were still unstrung and they ran hither and thither striking wildly each thinking himself the last survivor of the crew,novel
"wow, that sounds like a lot of fun. did you get to see any of the other crew members?",chit-chat
man to man they were the stronger but they fought on the defensive only which enabled the boys to hunt in pairs and choose their quarry,novel
that sounds like a lot of fun. i'm glad they were able to do that.,chit-chat
some of the miscreants leapt into the sea others hid in dark recesses where they were found by slightly who did not fight but ran about with a lantern which he flashed in their faces so that they were half blinded and fell as an easy prey to the reeking swords of the other boys,novel
"wow, that must have been scary. how did they manage to get out of the sea?",chit-chat
there was little sound to be heard but the clang of weapons an occasional screech or splash and slightly monotonously countingfivesixseveneightnineteneleven,novel
that sounds like a lot of fun! i'm glad you didn't hear anything.,chit-chat
i think all were gone when a group of savage boys surrounded hook who seemed to have a charmed life as he kept them at bay in that circle of fire,novel
that's interesting. i've never heard of that before. what's it about?,chit-chat
they had done for his dogs but this man alone seemed to be a match for them all,novel
i'm sorry to hear that. i hope you're able to get them back together.,chit-chat
again and again they closed upon him and again and again he hewed a clear space,novel
"i don't know about you, but i'm not a fan of his music.",chit-chat
he had lifted up one boy with his hook and was using him as a buckler when another who had just passed his sword through mullins sprang into the fray,novel
"wow, that's pretty intense. i'm sorry you had to go through that.",chit-chat
put up your swords boys cried the newcomer this man is mine thus suddenly hook found himself face to face with peter,novel
that's awesome! hook is such a great artist. i'm so happy for him.,chit-chat
the others drew back and formed a ring around them,novel
that's so cool! i've never heard of that before. what's it about?,chit-chat
for long the two enemies looked at one another hook shuddering slightly and peter with the strange smile upon his face,novel
"wow, that's really interesting. what did you do to make the two enemies smile?",chit-chat
so pan said hook at last this is all your doing ay james hook came the stern answer it is all my doing proud and insolent youth said hook prepare to meet thy doom dark and sinister man peter answered have at thee without more words they fell to and for a space there was no advantage to either blade,novel
i'm not familiar with james hook. what's his name? is he a rapper?,chit-chat
peter was a superb swordsman and parried with dazzling rapidity ever and anon he followed up a feint with a lunge that got past his foes defence but his shorter reach stood him in ill stead and he could not drive the steel home,novel
"wow, that's impressive. i've never heard of a swordsman before.",chit-chat
hook scarcely his inferior in brilliancy but not quite so nimble in wrist play forced him back by the weight of his onset hoping suddenly to end all with a favourite thrust taught him long ago by barbecue at rio but to his astonishment he found this thrust turned aside again and again,novel
i'm so sorry to hear that. i hope he's okay. what happened?,chit-chat
then he sought to close and give the quietus with his iron hook which all this time had been pawing the air but peter doubled under it and lunging fiercely pierced him in the ribs,novel
"wow, that's intense. i'm glad he didn't get hurt too bad.",chit-chat
at the sight of his own blood whose peculiar colour you remember was offensive to him the sword fell from hooks hand and he was at peters mercy,novel
"wow, that's really interesting. i've never heard of a sword falling from hooks hand before.",chit-chat
