text,category
against such fearful evidence it was not their belief in him that he needed it was his own,novel
that's a good point. it's hard for me to believe that he didn't know what he was doing.,chit-chat
he felt his ego slipping from him,novel
that's a good way to look at it. what did he do to deserve that?,chit-chat
dont desert me bully he whispered hoarsely to it,novel
i'm sorry to hear that. i hope you're able to get over it.,chit-chat
in his dark nature there was a touch of the feminine as in all the great pirates and it sometimes gave him intuitions,novel
that's interesting. i've never heard of that before. what's it about?,chit-chat
suddenly he tried the guessing game,novel
that's what i was thinking. i'm glad he didn't do it.,chit-chat
hook he called have you another voice now peter could never resist a game and he answered blithely in his own voice i have and another name ay ay vegetable asked hook,novel
that's so cool! i've never heard of him before. what's his name?,chit-chat
no mineral no animal yes man no this answer rang out scornfully,novel
"do you have any pets? i have a dog, a cat, a dog and a cat.",chit-chat
boy yes ordinary boy no wonderful boy to wendys pain the answer that rang out this time was yes are you in england no are you here yes hook was completely puzzled,novel
i'm so sorry to hear that. i hope you're feeling better now. are you okay?,chit-chat
you ask him some questions he said to the others wiping his damp brow,novel
that's a good idea. i think i'm going to ask him about it.,chit-chat
smee reflected,novel
have you ever smelled smelly reflected? it's the smell of someone's hair.,chit-chat
i cant think of a thing he said regretfully,novel
i can't think of a thing he said regretfully either. what did he say?,chit-chat
cant guess cant guess crowed peter,novel
"i don't know what crowed peter is, but i do know that he's a pretty cool guy.",chit-chat
do you give it up of course in his pride he was carrying the game too far and the miscreants saw their chance,novel
"i don't give it up, but i'm not going to let it get to me.",chit-chat
yes yes they answered eagerly,novel
i can't wait to see what they come up with. i'm so excited!,chit-chat
well then he cried i am peter pan pan,novel
that's funny. did you tell him that you are peter pan pan pan or something else?,chit-chat
in a moment hook was himself again and smee and starkey were his faithful henchmen,novel
i'm not familiar with starkey. what's his name? i've never heard of him.,chit-chat
now we have him hook shouted,novel
that would be so cool. i would love to see that. i think it would be really cool.,chit-chat
into the water smee,novel
i love that movie! it's one of my favorite movies of all time. have you seen it?,chit-chat
starkey mind the boat,novel
have you ever heard of starkey mind the boat? it's an american rock band.,chit-chat
take him dead or alive he leaped as he spoke and simultaneously came the gay voice of peter,novel
that's pretty cool. i've never heard of peter. is he a good actor?,chit-chat
are you ready boys ay ay from various parts of the lagoon,novel
are you ready boys ay ay from various parts of the lagoon? i'm not sure what that means.,chit-chat
then lam into the pirates the fight was short and sharp,novel
that's awesome. i'm glad you were able to get out of the situation.,chit-chat
first to draw blood was john who gallantly climbed into the boat and held starkey,novel
"oh wow, that's really interesting. i didn't know that. do you have a source for that?",chit-chat
there was fierce struggle in which the cutlass was torn from the pirates grasp,novel
"oh wow, that's interesting. what happened to the cutlaces that were torn?",chit-chat
he wriggled overboard and john leapt after him,novel
that's so sad. i'm sorry to hear that. how did he wriggle overboard?,chit-chat
the dinghy drifted away,novel
i'm sorry to hear that. do you have any idea what happened to the dinghy?,chit-chat
here and there a head bobbed up in the water and there was a flash of steel followed by a cry or a whoop,novel
that's so scary! i hope you're okay. i've never been in a situation like that.,chit-chat
in the confusion some struck at their own side,novel
oh no! how did that happen? did you have to call the police or did they call you?,chit-chat
the corkscrew of smee got tootles in the fourth rib but he was himself pinked in turn by curly,novel
"oh my god, that's terrible! i'm so sorry to hear that. did smee get hurt?",chit-chat
farther from the rock starkey was pressing slightly and the twins hard,novel
"wow, that's a long way from where i live. i'm sorry to hear that.",chit-chat
where all this time was peter,novel
"i'm not sure, but i hope he's okay. i've been waiting for him to come back.",chit-chat
he was seeking bigger game,novel
that's a good way to look at it. i'm not sure i could do that.,chit-chat
the others were all brave boys and they must not be blamed for backing from the pirate captain,novel
i don't blame them for backing from the pirate captain. i blame him for being so careless.,chit-chat
his iron claw made a circle of dead water round him from which they fled like affrighted fishes,novel
"wow, that's really interesting. did you find out who he was or what he did?",chit-chat
but there was one who did not fear him there was one prepared to enter that circle,novel
that's a good one. it's always good to be prepared for situations like that.,chit-chat
strangely it was not in the water that they met,novel
i'm sorry to hear that. i hope it wasn't in the water that they met.,chit-chat
hook rose to the rock to breathe and at the same moment peter scaled it on the opposite side,novel
i've never seen the hook to breathe. i'll have to check it out.,chit-chat
the rock was slippery as a ball and they had to crawl rather than climb,novel
that sounds like a lot of work. did you have to go to the gym to do it?,chit-chat
neither knew that the other was coming,novel
that's a bummer. i'm sorry to hear that. what did you do?,chit-chat
each feeling for a grip met the others arm in surprise they raised their heads their faces were almost touching so they met,novel
that's pretty cool. i've never met anyone like that before. what did you do?,chit-chat
some of the greatest heroes have confessed that just before they fell to they had a sinking,novel
"i'm not sure if that's true, but it's good to know.",chit-chat
had it been so with peter at that moment i would admit it,novel
"yes, it was. i felt so bad for him. i was so mad at him.",chit-chat
after all he was the only man that the seacook had feared,novel
that's pretty cool. i've never heard of the seacook before. what's it about?,chit-chat
but peter had no sinking he had one feeling only gladness and he gnashed his pretty teeth with joy,novel
"that's a good point. i didn't think of it that way, but you're right.",chit-chat
quick as thought he snatched a knife from hooks belt and was about to drive it home when he saw that he was higher up the rock than his foe,novel
oh no! that's terrible. i hope he didn't get hurt too bad.,chit-chat
it would not have been fighting fair,novel
i don't think so. i think it would have been a lot worse than it was.,chit-chat
he gave the pirate a hand to help him up,novel
"oh, i didn't know that. that's pretty cool. what did he do?",chit-chat
it was then that hook bit him,novel
what did he do? i don't really know much about him. i'm not sure what he's up to these days.,chit-chat
not the pain of this but its unfairness was what dazed peter,novel
i'm sorry to hear that. i hope you're able to get over it.,chit-chat
it made him quite helpless,novel
"i know, i was so mad at him for doing that. i felt so bad for him.",chit-chat
he could only stare horrified,novel
i know right? i can't even imagine what he would have looked like if he didn't.,chit-chat
every child is affected thus the first time he is treated unfairly,novel
i'm sorry to hear that. what did he do to deserve being treated unfairly?,chit-chat
all he thinks he has a right to when he comes to you to be yours is fairness,novel
that's what i'm thinking too. i don't know what to do.,chit-chat
after you have been unfair to him he will love you again but will never afterwards be quite the same boy,novel
i don't think so. i'm sure he will come around. he's a good boy.,chit-chat
no one ever gets over the first unfairness no one except peter,novel
peter is such a great character. he's one of my favorite characters of all time.,chit-chat
he often met it but he always forgot it,novel
i'm sorry to hear that. do you think he'll come back next year?,chit-chat
i suppose that was the real difference between him and all the rest,novel
"yes, it was. i felt so bad for him, but i was so proud of him.",chit-chat
so when he met it now it was like the first time and he could just stare helpless,novel
that's a good way to look at it. i'm glad he's okay.,chit-chat
twice the iron hand clawed him,novel
i'm not sure what you mean by that. are you talking about the iron hand?,chit-chat
a few moments afterwards the other boys saw hook in the water striking wildly for the ship no elation on the pestilent face now only white fear for the crocodile was in dogged pursuit of him,novel
"wow, that's scary. i'm glad the crocodile didn't get hurt.",chit-chat
on ordinary occasions the boys would have swum alongside cheering but now they were uneasy for they had lost both peter and wendy and were scouring the lagoon for them calling them by name,novel
that's so sad. i'm sorry to hear that. i hope you're okay.,chit-chat
they found the dinghy and went home in it shouting peter wendy as they went but no answer came save mocking laughter from the mermaids,novel
that's so funny! did they find the dinghy and go home in it shouting peter wendy as they went but no answer came save mock laughter from the mermaids?,chit-chat
they must be swimming back or flying the boys concluded,novel
i don't think so. i'm not sure what they are going to do.,chit-chat
they were not very anxious because they had such faith in peter,novel
that's a good reason to be anxious. i'm glad they were able to work it out.,chit-chat
they chuckled boylike because they would be late for bed and it was all mother wendys fault,novel
i'm sorry to hear that. i hope you're able to get some sleep.,chit-chat
when their voices died away there came cold silence over the lagoon and then a feeble cry,novel
that's so sad. i'm sorry you had to go through that. what happened?,chit-chat
help help two small figures were beating against the rock the girl had fainted and lay on the boys arm,novel
that's terrible. i'm sorry you had to go through that. what happened?,chit-chat
with a last effort peter pulled her up the rock and then lay down beside her,novel
that's so sweet of him. i'm sure he's proud of you.,chit-chat
even as he also fainted he saw that the water was rising,novel
that's pretty cool. i'm glad he was able to get out of there.,chit-chat
he knew that they would soon be drowned but he could do no more,novel
i'm sorry to hear that. i hope he's doing better now. what did he do?,chit-chat
as they lay side by side a mermaid caught wendy by the feet and began pulling her softly into the water,novel
that's pretty cool. i've never seen a mermaid in the water before. what did they do?,chit-chat
peter feeling her slip from him woke with a start and was just in time to draw her back,novel
that's a good way to look at it. i'm glad he didn't do that.,chit-chat
but he had to tell her the truth,novel
that's what i'm saying. i don't understand why he didn't tell her.,chit-chat
we are on the rock wendy he said but it is growing smaller,novel
that's good to hear. i'm sure it's going to get better.,chit-chat
soon the water will be over it she did not understand even now,novel
i'm sorry to hear that. i hope you're able to get over it.,chit-chat
we must go she said almost brightly,novel
i'm sorry to hear that. i hope you're able to find her soon.,chit-chat
yes he answered faintly,novel
what did he answer? i can't seem to find it. i'm sorry.,chit-chat
shall we swim or fly peter he had to tell her,novel
i've never heard of this song before. is it a song by the same artist?,chit-chat
do you think you could swim or fly as far as the island wendy without my help she had to admit that she was too tired,novel
i don't think i could swim or fly as far as the wendy without my help she had to admit that she was too tired.,chit-chat
he moaned,novel
i'm so sorry to hear that. i hope he's feeling better now. what did he do?,chit-chat
what is it she asked anxious about him at once,novel
i don't know. i'm not sure. i think it's just something i've been doing for a while.,chit-chat
i cant help you wendy,novel
i don't know what i'm going to do. i can't stop thinking about it.,chit-chat
hook wounded me,novel
i'm sorry to hear that. hook is a great song. what happened to it?,chit-chat
i can neither fly nor swim do you mean we shall both be drowned look how the water is rising they put their hands over their eyes to shut out the sight,novel
"yes, that's exactly what i mean. do you have any other hobbies?",chit-chat
they thought they would soon be no more,novel
i'm sorry to hear that. i hope you're able to get over it.,chit-chat
as they sat thus something brushed against peter as light as a kiss and stayed there as if saying timidly can i be of any use it was the tail of a kite which michael had made some days before,novel
that's interesting. i've never heard of a kite before. what kind of kite was it?,chit-chat
it had torn itself out of his hand and floated away,novel
"oh no, that's terrible. i hope it didn't hurt too much. what happened?",chit-chat
michaels kite peter said without interest but next moment he had seized the tail and was pulling the kite toward him,novel
that's pretty cool. i've never seen a kite like that before. what kind of kite is it?,chit-chat
it lifted michael off the ground he cried why should it not carry you both of us it cant lift two michael and curly tried let us draw lots wendy said bravely,novel
i'm sorry to hear that. i hope you're able to get it fixed.,chit-chat
and you a lady never already he had tied the tail round her,novel
i'm not sure what you're talking about. are you talking about a guy or a girl?,chit-chat
she clung to him she refused to go without him but with a goodbye wendy he pushed her from the rock and in a few minutes she was borne out of his sight,novel
"wow, that's pretty intense. i'm not sure if i could do that.",chit-chat
peter was alone on the lagoon,novel
peter was alone on the lagoon? i've never heard of that. what did peter do?,chit-chat
the rock was very small now soon it would be submerged,novel
i'm sorry to hear that. i hope you're able to find it soon.,chit-chat
pale rays of light tiptoed across the waters and by and by there was to be heard a sound at once the most musical and the most melancholy in the world the mermaids calling to the moon,novel
"i've never been to the moon, but i'd like to go one day.",chit-chat
peter was not quite like other boys but he was afraid at last,novel
i'm sorry to hear that. what did he do to make you feel that way?,chit-chat
a tremour ran through him like a shudder passing over the sea but on the sea one shudder follows another till there are hundreds of them and peter felt just the one,novel
"wow, that's scary! i'm glad you were able to get away from him.",chit-chat
next moment he was standing erect on the rock again with that smile on his face and a drum beating within him,novel
hahaha... that's so funny. i'm laughing so hard right now.,chit-chat
it was saying to die will be an awfully big adventure chapter ix,novel
i don't know if i'm ready for that. it's been a while since i've seen it.,chit-chat
the never bird the last sound peter heard before he was quite alone were the mermaids retiring one by one to their bedchambers under the sea,novel
i've never heard of the never bird the last sound peter heard before he was quite alone were the mermaids retiring one by one to their bedchambers under the sea,chit-chat
he was too far away to hear their doors shut but every door in the coral caves where they live rings a tiny bell when it opens or closes as in all the nicest houses on the mainland and he heard the bells,novel
"wow, that's pretty cool. i've never been to a coral cave before.",chit-chat
steadily the waters rose till they were nibbling at his feet and to pass the time until they made their final gulp he watched the only thing on the lagoon,novel
that sounds like a lot of fun. what kind of music do you like to listen to?,chit-chat
he thought it was a piece of floating paper perhaps part of the kite and wondered idly how long it would take to drift ashore,novel
"that's a good guess, but i'm not sure how long it would take.",chit-chat
presently he noticed as an odd thing that it was undoubtedly out upon the lagoon with some definite purpose for it was fighting the tide and sometimes winning and when it won peter always sympathetic to the weaker side could not help clapping it was such a gallant piece of paper,novel
that's interesting. i've never heard of a gallant piece of paper before.,chit-chat
it was not really a piece of paper it was the never bird making desperate efforts to reach peter on the nest,novel
i'm sorry to hear that. i hope you're able to find him soon.,chit-chat
by working her wings in a way she had learned since the nest fell into the water she was able to some extent to guide her strange craft but by the time peter recognised her she was very exhausted,novel
"wow, that's really interesting. i've always wanted to learn how to fly.",chit-chat
she had come to save him to give him her nest though there were eggs in it,novel
that's very nice of her. i'm sure she's proud of him.,chit-chat
i rather wonder at the bird for though he had been nice to her he had also sometimes tormented her,novel
i don't think i've ever seen a bird tormenting a human before.,chit-chat
i can suppose only that like mrs,novel
that's what i was thinking. i'm not sure if i'll ever get married.,chit-chat
darling and the rest of them she was melted because he had all his first teeth,novel
i'm sorry to hear that. i hope he's doing better now that he has all his teeth.,chit-chat
she called out to him what she had come for and he called out to her what she was doing there but of course neither of them understood the others language,novel
i'm sorry to hear that. i hope you're able to get over it.,chit-chat
in fanciful stories people can talk to the birds freely and i wish for the moment i could pretend that this were such a story and say that peter replied intelligently to the never bird but truth is best and i want to tell you only what really happened,novel
i'm not sure what you mean by fanciful stories people can talk to the birds freely and i wish for the moment i could pretend that this were such a story and say that peter replied intelligently to the never bird but truth is best and i want to tell you only what really happened,chit-chat
well not only could they not understand each other but they forgot their manners,novel
that's so true. it's like they don't even know what they're doing.,chit-chat
iwantyoutogetintothenest the bird called speaking as slowly and distinctly as possible andthenyoucandriftashore butiamtootiredtobringitanynearersoyoumusttry toswimtoit what are you quacking about peter answered,novel
i've never heard of that bird before. i'll have to look it up.,chit-chat
why dont you let the nest drift as usual iwantyou the bird said and repeated it all over,novel
that's a good idea. i'll try that next time. do you have a favorite bird?,chit-chat
then peter tried slow and distinct,novel
"that's what i thought too, but then i realized that it was peter who did it.",chit-chat
whatareyouquackingabout and so on,novel
i'm trying to figure out what to do with my life. i don't know what i want to do.,chit-chat
the never bird became irritated they have very short tempers,novel
i'm sorry to hear that. i hope it didn't upset you too much.,chit-chat
you dunderheaded little jay she screamed why dont you do as i tell you peter felt that she was calling him names and at a venture he retorted hotly so are you then rather curiously they both snapped out the same remark shut up shut up nevertheless the bird was determined to save him if she could and by one last mighty effort she propelled the nest against the rock,novel
"i'm sorry, i don't understand what you're saying. what are you trying to say?",chit-chat
then up she flew deserting her eggs so as to make her meaning clear,novel
that's a good way to look at it. i'm glad she didn't do that.,chit-chat
then at last he understood and clutched the nest and waved his thanks to the bird as she fluttered overhead,novel
that's so sweet of him. i'm glad he was able to learn from his mistakes.,chit-chat
it was not to receive his thanks however that she hung there in the sky it was not even to watch him get into the nest it was to see what he did with her eggs,novel
i'm sorry to hear that. i hope you're able to get over it.,chit-chat
there were two large white eggs and peter lifted them up and reflected,novel
that's pretty cool. i've never seen a white egg before. what was the name of the egg?,chit-chat
the bird covered her face with her wings so as not to see the last of them but she could not help peeping between the feathers,novel
"oh wow, that's interesting. did she have a lot of trouble seeing the last of them?",chit-chat
i forget whether i have told you that there was a stave on the rock driven into it by some buccaneers of long ago to mark the site of buried treasure,novel
that's interesting. i've never heard of that before. do you have a source?,chit-chat
the children had discovered the glittering hoard and when in a mischievous mood used to fling showers of moidores diamonds pearls and pieces of eight to the gulls who pounced upon them for food and then flew away raging at the scurvy trick that had been played upon them,novel
"wow, that sounds like a lot of fun. what was the scurvy trick that was played on them?",chit-chat
the stave was still there and on it starkey had hung his hat a deep tarpaulin watertight with a broad brim,novel
that's pretty cool. i've never heard of starkey before. what's his name?,chit-chat
peter put the eggs into this hat and set it on the lagoon,novel
i'm not sure what you mean by that. are you saying that peter put the eggs into this hat and set it on the lagoon?,chit-chat
it floated beautifully,novel
i'm glad you like it. it's one of my favorite things to do.,chit-chat
the never bird saw at once what he was up to and screamed her admiration of him and alas peter crowed his agreement with her,novel
that's so funny! i've never seen that movie. what was it about?,chit-chat
then he got into the nest reared the stave in it as a mast and hung up his shirt for a sail,novel
that's pretty cool. i've never seen a sail like that before. what kind of sail is it?,chit-chat
at the same moment the bird fluttered down upon the hat and once more sat snugly on her eggs,novel
that's so funny! did you find out who it was? did you catch it?,chit-chat
she drifted in one direction and he was borne off in another both cheering,novel
that's so sad. i'm sorry to hear that. i hope she's okay.,chit-chat
of course when peter landed he beached his barque in a place where the bird would easily find it but the hat was such a great success that she abandoned the nest,novel
i didn't know she abandoned the nest. that's so sad. i'm glad she found it.,chit-chat
it drifted about till it went to pieces and often starkey came to the shore of the lagoon and with many bitter feelings watched the bird sitting on his hat,novel
that's so sad. i'm sorry you had to go through that. what did you do?,chit-chat
as we shall not see her again it may be worth mentioning here that all never birds now build in that shape of nest with a broad brim on which the youngsters take an airing,novel
i'm sorry to hear that. i hope you have a good rest of your day.,chit-chat
great were the rejoicings when peter reached the home under the ground almost as soon as wendy who had been carried hither and thither by the kite,novel
that's so sad. i can't imagine what that must've been like.,chit-chat
every boy had adventures to tell but perhaps the biggest adventure of all was that they were several hours late for bed,novel
"wow, that must have been quite an adventure. did you have to go to bed early?",chit-chat
this so inflated them that they did various dodgy things to get staying up still longer such as demanding bandages but wendy though glorying in having them all home again safe and sound was scandalised by the lateness of the hour and cried to bed to bed in a voice that had to be obeyed,novel
"wow, that's crazy. i'm sorry you had to go through that. i hope you're okay.",chit-chat
next day however she was awfully tender and gave out bandages to every one and they played till bedtime at limping about and carrying their arms in slings,novel
that's terrible. i'm sorry to hear that. i hope she's okay.,chit-chat
chapter x,novel
i'm a big fan of x - men. it's an american comic book.,chit-chat
the happy home one important result of the brush on the lagoon was that it made the redskins their friends,novel
"that's really cool. i've never been to a happy home, but i'd love to go one day.",chit-chat
peter had saved tiger lily from a dreadful fate and now there was nothing she and her braves would not do for him,novel
i'm sorry to hear that. i hope you're able to find peace in your life.,chit-chat
all night they sat above keeping watch over the home under the ground and awaiting the big attack by the pirates which obviously could not be much longer delayed,novel
"oh wow, that must have been scary. i hope you're okay. what did they do?",chit-chat
