text,category
the project gutenberg ebook of peter pan this ebook is for the use of anyone anywhere in the united states and most other parts of the world at no cost and with almost no restrictions whatsoever,novel
i love the gutenberg ebook! it's one of my favorite books of all time.,chit-chat
you may copy it give it away or reuse it under the terms of the project gutenberg license included with this ebook or online at wwwgutenbergorg,novel
that's a great idea! i'll have to look into that. thank you!,chit-chat
if you are not located in the united states you will have to check the laws of the country where you are located before using this ebook,novel
i am located in the us. i will have to check the laws of the country where i are located before using this ebook,chit-chat
title peter pan author j m barrie release date june 25 2008 ebook 16 most recently updated february 15 2021 language english start of the project gutenberg ebook peter pan peter pan peter and wendy by j m barrie james matthew barrie a millennium fulcrum edition produced in 1991 by duncan research,novel
"wow, that's a long time since i've read a book. is it good?",chit-chat
note that while a copyright was initially claimed for the labor involved in digitization that copyright claim is not consistent with current copyright requirements,novel
that's a bummer. how long did it take for the claim to be processed?,chit-chat
this text which matches the 1911 original publication is in the public domain in the us,novel
that's interesting. i'm not familiar with the 1911 version. what is it about?,chit-chat
contents chapter i peter breaks through chapter ii,novel
i'm sorry to hear that. i hope you're able to keep up with him.,chit-chat
the shadow chapter iii,novel
have you ever played shadow of the shadow ii? it's one of my favorite games.,chit-chat
come away come away,novel
i don't know what i'm going to do... i can't stop thinking about it.,chit-chat
chapter iv,novel
"do you like to read? i've been reading a lot of manga lately, and i'm really enjoying it.",chit-chat
the flight chapter v the island come true chapter vi,novel
i've never heard of the island come true. what's the name of it?,chit-chat
the little house chapter vii,novel
do you like the little house chapter vi? it's one of my favorite books of all time.,chit-chat
the home under the ground chapter viii,novel
the home under the ground is one of my favorite books. it's one of the best books i've ever read.,chit-chat
the mermaids lagoon chapter ix,novel
have you ever read the mermaids lagoon? it's one of my favorite books of all time.,chit-chat
the never bird chapter x,novel
have you ever read the never bird chapter x? it's a series of short stories.,chit-chat
the happy home chapter xi,novel
have you ever read the happy home chapter xi? it's my favorite book of all time.,chit-chat
wendys story chapter xii,novel
i'm a big fan of wendys story. it's one of my favorite series. have you read it?,chit-chat
the children are carried off chapter xiii,novel
oh really? i didn't know that. i'll have to check it out.,chit-chat
do you believe in fairies,novel
"i don't believe in fairy tales, but i do believe in the existence of fairies.",chit-chat
chapter xiv,novel
"i've been reading a lot of manga lately, it's a great way to get to know the author.",chit-chat
the pirate ship chapter xv,novel
"i haven't read any of the pirate ship chapters, but i've heard good things about them.",chit-chat
hook or me this time chapter xvi,novel
hook or this time is a good one. it's an american horror story. have you heard of it?,chit-chat
the return home chapter xvii,novel
are you familiar with the return home chapter xvii? it's a series of short stories.,chit-chat
when wendy grew up chapter i peter breaks through all children except one grow up,novel
that's sad. i'm sorry to hear that. do you have any siblings?,chit-chat
they soon know that they will grow up and the way wendy knew was this,novel
"i don't know if they will grow up, but i hope they do. i'm rooting for them.",chit-chat
one day when she was two years old she was playing in a garden and she plucked another flower and ran with it to her mother,novel
"oh my gosh, that's so cute! i bet she was so proud of you!",chit-chat
i suppose she must have looked rather delightful for mrs,novel
she sure did. i'm not sure if i'll ever be able to live without her.,chit-chat
darling put her hand to her heart and cried oh why cant you remain like this for ever this was all that passed between them on the subject but henceforth wendy knew that she must grow up,novel
i don't know what i would do without darling. she's my favorite character.,chit-chat
you always know after you are two,novel
"that's true, but i'm not sure if i'll be able to do it.",chit-chat
two is the beginning of the end,novel
i hope so. i'm not sure if i'll be able to handle it.,chit-chat
of course they lived at 14 and until wendy came her mother was the chief one,novel
that's a good point. i didn't even think about that. it's crazy that they lived so far away.,chit-chat
she was a lovely lady with a romantic mind and such a sweet mocking mouth,novel
that's so sweet. i'm so happy for her. she's a great person.,chit-chat
her romantic mind was like the tiny boxes one within the other that come from the puzzling east however many you discover there is always one more and her sweet mocking mouth had one kiss on it that wendy could never get though there it was perfectly conspicuous in the righthand corner,novel
"wow, that's really interesting. i've never heard of a romantic mind like that before.",chit-chat
the way mr,novel
have you ever watched the way mr. mr? it's an american drama television series.,chit-chat
darling won her was this the many gentlemen who had been boys when she was a girl discovered simultaneously that they loved her and they all ran to her house to propose to her except mr,novel
that's interesting. i've never heard of darling winning her. is she still alive?,chit-chat
darling who took a cab and nipped in first and so he got her,novel
that's so nice of him. i'm glad he's doing well for himself.,chit-chat
he got all of her except the innermost box and the kiss,novel
"wow, that's a lot of money. how did you manage to get all of it?",chit-chat
he never knew about the box and in time he gave up trying for the kiss,novel
oh no! that's so sad. i hope he learned his lesson. i'm sorry you had to go through that.,chit-chat
wendy thought napoleon could have got it but i can picture him trying and then going off in a passion slamming the door,novel
wendy thought he could have got it but i can picture him trying and then going off in a passion slam the door,chit-chat
mr,novel
have you ever heard of mr. robot? it's a tv series based on mr. mr. universe.,chit-chat
darling used to boast to wendy that her mother not only loved him but respected him,novel
"oh, that's interesting. i didn't know that. what did she do?",chit-chat
he was one of those deep ones who know about stocks and shares,novel
"yes, he was. he was a very smart man. i wish i knew more about him.",chit-chat
of course no one really knows but he quite seemed to know and he often said stocks were up and shares were down in a way that would have made any woman respect him,novel
that's interesting. i've never heard that before. do you have a source?,chit-chat
mrs,novel
have you ever been to the united states? it's a sovereign state in north america.,chit-chat
darling was married in white and at first she kept the books perfectly almost gleefully as if it were a game not so much as a brussels sprout was missing but by and by whole cauliflowers dropped out and instead of them there were pictures of babies without faces,novel
"oh my gosh, that's awful! i'm so sorry to hear that. i hope you're okay.",chit-chat
she drew them when she should have been totting up,novel
that's a good point. i didn't think of that. i'll have to do that next time.,chit-chat
they were mrs darlings guesses,novel
"i've never read that book, but i'm sure it's a good one.",chit-chat
wendy came first then john then michael,novel
"that's a good point, i didn't think of that. do you know who john was?",chit-chat
for a week or two after wendy came it was doubtful whether they would be able to keep her as she was another mouth to feed,novel
that's so sad. i hope she's okay. i'm sure she'll be fine.,chit-chat
mr,novel
have you ever heard of mr. robot? it's a tv series based on mr. mr. universe.,chit-chat
darling was frightfully proud of her but he was very honourable and he sat on the edge of mrs darlings bed holding her hand and calculating expenses while she looked at him imploringly,novel
i'm sorry to hear that. what did darling do to make him feel that way?,chit-chat
she wanted to risk it come what might but that was not his way his way was with a pencil and a piece of paper and if she confused him with suggestions he had to begin at the beginning again,novel
that's a good point. i'm not sure how i feel about it though.,chit-chat
now dont interrupt he would beg of her,novel
i don't think so. i think she's just trying to make me feel better about myself.,chit-chat
i have one pound seventeen here and two and six at the office i can cut off my coffee at the office say ten shillings making two nine and six with your eighteen and three makes three nine seven with five naught naught in my chequebook makes eight nine sevenwho is that movingeight nine seven dot and carry sevendont speak my ownand the pound you lent to that man who came to the doorquiet childdot and carry childthere youve done itdid i say nine nine seven,novel
i've never heard of a childdot before. what's the name of it?,chit-chat
yes i said nine nine seven the question is can we try it for a year on nine nine seven of course we can george she cried,novel
i'm sorry to hear that. i hope you're able to get over it.,chit-chat
but she was prejudiced in wendys favour and he was really the grander character of the two,novel
"i don't think she was prejudiced, but i do agree with you.",chit-chat
remember mumps he warned her almost threateningly and off he went again,novel
i don't think i've ever heard of mumps. what did he do?,chit-chat
mumps one pound that is what i have put down but i daresay it will be more like thirty shillingsdont speakmeasles one five german measles half a guinea makes two fifteen sixdont waggle your fingerwhoopingcough say fifteen shillingsand so on it went and it added up differently each time but at last wendy just got through with mumps reduced to twelve six and the two kinds of measles treated as one,novel
"wow, that's a lot of shillingsand. i'm sorry to hear that.",chit-chat
there was the same excitement over john and michael had even a narrower squeak but both were kept and soon you might have seen the three of them going in a row to miss fulsoms kindergarten school accompanied by their nurse,novel
that's so sweet of them. i'm glad they got to see each other.,chit-chat
mrs,novel
have you ever been to the united states? it's a sovereign state in north america.,chit-chat
darling loved to have everything just so and mr,novel
i'm so sorry to hear that. i hope he's doing better now that you have him.,chit-chat
darling had a passion for being exactly like his neighbours so of course they had a nurse,novel
that's a good point. i don't think i've ever seen a nurse before.,chit-chat
as they were poor owing to the amount of milk the children drank this nurse was a prim newfoundland dog called nana who had belonged to no one in particular until the darlings engaged her,novel
that's so sad. i'm sorry to hear that. i hope she's doing better now.,chit-chat
she had always thought children important however and the darlings had become acquainted with her in kensington gardens where she spent most of her spare time peeping into perambulators and was much hated by careless nursemaids whom she followed to their homes and complained of to their mistresses,novel
"wow, that's interesting. i didn't know she was a nursemaid.",chit-chat
she proved to be quite a treasure of a nurse,novel
that's great to hear. i'm sure she's a great nurse. what's your favorite nurse?,chit-chat
how thorough she was at bathtime and up at any moment of the night if one of her charges made the slightest cry,novel
i'm sorry to hear that. i hope you were able to get her to forgive you.,chit-chat
of course her kennel was in the nursery,novel
"i know, right? i was so mad at her for doing that. i felt so bad for her.",chit-chat
she had a genius for knowing when a cough is a thing to have no patience with and when it needs stocking around your throat,novel
that's what i was thinking. i've been coughing since i was a kid.,chit-chat
she believed to her last day in oldfashioned remedies like rhubarb leaf and made sounds of contempt over all this newfangled talk about germs and so on,novel
that's awful. i'm sorry to hear that. what did she say about germs?,chit-chat
it was a lesson in propriety to see her escorting the children to school walking sedately by their side when they were well behaved and butting them back into line if they strayed,novel
that's a good lesson. i'm glad you were able to learn from her.,chit-chat
on johns footer days she never once forgot his sweater and she usually carried an umbrella in her mouth in case of rain,novel
that's really nice of her. i've never heard of johns footer days.,chit-chat
there is a room in the basement of miss fulsoms school where the nurses wait,novel
that's cool. i've never been to miss fulsoms school. what is it like?,chit-chat
they sat on forms while nana lay on the floor but that was the only difference,novel
that sounds like a lot of fun. did you get to see any of the other matches?,chit-chat
they affected to ignore her as of an inferior social status to themselves and she despised their light talk,novel
i'm sorry to hear that. i hope she's able to get over it.,chit-chat
she resented visits to the nursery from mrs darlings friends but if they did come she first whipped off michaels pinafore and put him into the one with blue braiding and smoothed out wendy and made a dash at johns hair,novel
that sounds like a lot of fun. what did she do to get him to do that?,chit-chat
no nursery could possibly have been conducted more correctly and mr,novel
that's what i was thinking. i don't know what to do with myself.,chit-chat
darling knew it yet he sometimes wondered uneasily whether the neighbours talked,novel
that's a good way to look at it. what did darling say to the neighbors?,chit-chat
he had his position in the city to consider,novel
that's good to hear. i'm glad he's doing well in the city.,chit-chat
nana also troubled him in another way,novel
i don't know what you mean by that. are you referring to something i'm not aware of?,chit-chat
he had sometimes a feeling that she did not admire him,novel
i'm sorry to hear that. what did he do to make you feel that way?,chit-chat
i know she admires you tremendously george mrs,novel
i love george mrs. he's such a great man. i wish i could have known him when i was younger.,chit-chat
darling would assure him and then she would sign to the children to be specially nice to father,novel
that's a good way to look at it. i think she would be a good parent.,chit-chat
lovely dances followed in which the only other servant liza was sometimes allowed to join,novel
that's so cool! i've never heard of such a thing before. i'll have to check it out.,chit-chat
such a midget she looked in her long skirt and maids cap though she had sworn when engaged that she would never see ten again,novel
"wow, that's a big deal. i'm sorry to hear that. what happened?",chit-chat
the gaiety of those romps,novel
i'm not sure what you mean. are you talking about the gaiety of the romps?,chit-chat
and gayest of all was mrs,novel
i'm so sorry to hear that. i hope she's doing better now. what happened to her?,chit-chat
darling who would pirouette so wildly that all you could see of her was the kiss and then if you had dashed at her you might have got it,novel
i don't think i could do that. i'm not very good at flirting.,chit-chat
there never was a simpler happier family until the coming of peter pan,novel
what happened to peter pan? i've never heard of him. what's his name?,chit-chat
mrs,novel
have you ever been to the united states? it's a sovereign state in north america.,chit-chat
darling first heard of peter when she was tidying up her childrens minds,novel
"aww, that's so sweet of her. i've never heard of him.",chit-chat
it is the nightly custom of every good mother after her children are asleep to rummage in their minds and put things straight for next morning repacking into their proper places the many articles that have wandered during the day,novel
that's a good way to look at it. i don't think i could do that.,chit-chat
if you could keep awake but of course you cant you would see your own mother doing this and you would find it very interesting to watch her,novel
that's a good point. i'm not sure if i'd be able to keep up with her.,chit-chat
it is quite like tidying up drawers,novel
tidying up? what does that mean? i'm not sure what that means lol,chit-chat
you would see her on her knees i expect lingering humorously over some of your contents wondering where on earth you had picked this thing up making discoveries sweet and not so sweet pressing this to her cheek as if it were as nice as a kitten and hurriedly stowing that out of sight,novel
that's a good way to look at it. i don't think i could do that.,chit-chat
when you wake in the morning the naughtiness and evil passions with which you went to bed have been folded up small and placed at the bottom of your mind and on the top beautifully aired are spread out your prettier thoughts ready for you to put on,novel
that's a good way to look at it. i'm not sure i've ever felt that way before.,chit-chat
i dont know whether you have ever seen a map of a persons mind,novel
i've never seen a map of a person's mind. what's it about?,chit-chat
doctors sometimes draw maps of other parts of you and your own map can become intensely interesting but catch them trying to draw a map of a childs mind which is not only confused but keeps going round all the time,novel
that's interesting. i've never seen a map of a childs mind before.,chit-chat
there are zigzag lines on it just like your temperature on a card and these are probably roads in the island for the neverland is always more or less an island with astonishing splashes of colour here and there and coral reefs and rakishlooking craft in the offing and savages and lonely lairs and gnomes who are mostly tailors and caves through which a river runs and princes with six elder brothers and a hut fast going to decay and one very small old lady with a hooked nose,novel
that sounds like a lot of fun! i'd love to visit one of these islands one day.,chit-chat
it would be an easy map if that were all but there is also first day at school religion fathers the round pond needlework murders hangings verbs that take the dative chocolate pudding day getting into braces say ninetynine threepence for pulling out your tooth yourself and so on and either these are part of the island or they are another map showing through and it is all rather confusing especially as nothing will stand still,novel
"wow, that's a lot of information. i'll have to look into that.",chit-chat
of course the neverlands vary a good deal,novel
"yeah, it's a good deal. i think i'm going to pick it up.",chit-chat
johns for instance had a lagoon with flamingoes flying over it at which john was shooting while michael who was very small had a flamingo with lagoons flying over it,novel
i've never heard of john's lagoon. i'll have to check it out.,chit-chat
john lived in a boat turned upside down on the sands michael in a wigwam wendy in a house of leaves deftly sewn together,novel
i've never heard of michael in a wigwam wendy. what is it about?,chit-chat
john had no friends michael had friends at night wendy had a pet wolf forsaken by its parents but on the whole the neverlands have a family resemblance and if they stood still in a row you could say of them that they have each others nose and so forth,novel
i've never heard of the wolf forsaken. what's it look like?,chit-chat
on these magic shores children at play are for ever beaching their coracles,novel
i don't think i've ever beached my coracles. i'm not sure what that means.,chit-chat
we too have been there we can still hear the sound of the surf though we shall land no more,novel
that's good to hear. it's always good to be prepared for the worst.,chit-chat
of all delectable islands the neverland is the snuggest and most compact not large and sprawly you know with tedious distances between one adventure and another but nicely crammed,novel
"i've never been to the neverland, but i'd love to go. have you been?",chit-chat
when you play at it by day with the chairs and tablecloth it is not in the least alarming but in the two minutes before you go to sleep it becomes very real,novel
that's a good way to look at it. i'm not sure i could do that.,chit-chat
that is why there are nightlights,novel
i didn't know there were nightlights. i'll have to look into that.,chit-chat
occasionally in her travels through her childrens minds mrs,novel
that's really sweet of her. i'm sure she's very proud of you.,chit-chat
darling found things she could not understand and of these quite the most perplexing was the word peter,novel
i'm sorry to hear that. what did darling find that she couldn't understand?,chit-chat
she knew of no peter and yet he was here and there in john and michaels minds while wendys began to be scrawled all over with him,novel
that's pretty crazy. i'm glad she didn't do anything to him.,chit-chat
the name stood out in bolder letters than any of the other words and as mrs,novel
i didn't even notice until you pointed it out. what's your favorite letter?,chit-chat
darling gazed she felt that it had an oddly cocky appearance,novel
i'm sorry to hear that. what did you do to make her feel that way?,chit-chat
yes he is rather cocky wendy admitted with regret,novel
i don't think so. i think he's just trying to make himself feel better.,chit-chat
her mother had been questioning her,novel
that's so sad. i hope she's okay. i'm sorry to hear that.,chit-chat
but who is he my pet he is peter pan you know mother at first mrs,novel
i'm sorry to hear that. i hope you're able to find peace with him.,chit-chat
darling did not know but after thinking back into her childhood she just remembered a peter pan who was said to live with the fairies,novel
"that's really cool. i've never seen the movie, but i hear it's pretty good.",chit-chat
there were odd stories about him as that when children died he went part of the way with them so that they should not be frightened,novel
that's interesting. i've never heard of that before. what was it about?,chit-chat
she had believed in him at the time but now that she was married and full of sense she quite doubted whether there was any such person,novel
i'm sorry to hear that. i hope she's able to get over it.,chit-chat
besides she said to wendy he would be grown up by this time oh no he isnt grown up wendy assured her confidently and he is just my size she meant that he was her size in both mind and body she didnt know how she knew she just knew it,novel
that's a good point. it's hard for me to believe that she didn't know that.,chit-chat
mrs,novel
have you ever been to the united states? it's a sovereign state in north america.,chit-chat
darling consulted mr,novel
have you ever heard of darling darling mr? it's a fictional character from the american horror story series.,chit-chat
darling but he smiled poohpooh,novel
that's so cute! i've never seen a dog smile like that before. do you like dogs?,chit-chat
mark my words he said it is some nonsense nana has been putting into their heads just the sort of idea a dog would have,novel
i don't think i've ever heard of nana. what's it about?,chit-chat
leave it alone and it will blow over but it would not blow over and soon the troublesome boy gave mrs,novel
that's a good point. i guess i'll just have to wait and see.,chit-chat
darling quite a shock,novel
"i know, i was so shocked. it's been a while since i've seen it.",chit-chat
children have the strangest adventures without being troubled by them,novel
"that's true, but i'm not sure if i'd want to be a parent.",chit-chat
for instance they may remember to mention a week after the event happened that when they were in the wood they had met their dead father and had a game with him,novel
that's a really good idea. i'll try to remember that for next time.,chit-chat
it was in this casual way that wendy one morning made a disquieting revelation,novel
what did she say? i've never heard of a disquieting revelation before. what was it about?,chit-chat
some leaves of a tree had been found on the nursery floor which certainly were not there when the children went to bed and mrs,novel
"oh no, that's terrible. i'm so sorry you had to go through that.",chit-chat
darling was puzzling over them when wendy said with a tolerant smile i do believe it is that peter again whatever do you mean wendy it is so naughty of him not to wipe his feet wendy said sighing,novel
i'm not sure what you mean by that. i don't understand what you're saying.,chit-chat
she was a tidy child,novel
that's good to hear. what did she do to make you think she was tidy?,chit-chat
she explained in quite a matteroffact way that she thought peter sometimes came to the nursery in the night and sat on the foot of her bed and played on his pipes to her,novel
"wow, that's really interesting. did you find out who did it or did she tell you?",chit-chat
unfortunately she never woke so she didnt know how she knew she just knew,novel
i'm sorry to hear that. do you think she'll be able to get over it?,chit-chat
