text,category
john and michael raced michael getting a start,novel
that's good to hear. i'm a big fan of michael and john racing.,chit-chat
they recalled with contempt that not so long ago they had thought themselves fine fellows for being able to fly round a room,novel
i'm sorry to hear that. i hope you're able to get back on your feet soon.,chit-chat
not long ago,novel
i'm sorry to hear that. i hope you're doing better now. what happened?,chit-chat
but how long ago,novel
it was a long time ago. i'm not sure how long it's been.,chit-chat
they were flying over the sea before this thought began to disturb wendy seriously,novel
i'm sorry to hear that. i hope you're okay. what did they do?,chit-chat
john thought it was their second sea and their third night,novel
john thought it was their second sea and the third night? what did he think it was?,chit-chat
sometimes it was dark and sometimes light and now they were very cold and again too warm,novel
that's a good way to look at it. i'm glad it's not just me.,chit-chat
did they really feel hungry at times or were they merely pretending because peter had such a jolly new way of feeding them,novel
i don't think they felt hungry at all. i think they were just trying to make me feel better.,chit-chat
his way was to pursue birds who had food in their mouths suitable for humans and snatch it from them then the birds would follow and snatch it back and they would all go chasing each other gaily for miles parting at last with mutual expressions of goodwill,novel
"wow, that's interesting. i've never heard of a bird like that before.",chit-chat
but wendy noticed with gentle concern that peter did not seem to know that this was rather an odd way of getting your bread and butter nor even that there are other ways,novel
that's a good point. i didn't think of that. i'll have to think about that.,chit-chat
certainly they did not pretend to be sleepy they were sleepy and that was a danger for the moment they popped off down they fell,novel
that's what i was thinking. it's hard to believe they didn't do anything.,chit-chat
the awful thing was that peter thought this funny,novel
what did he think was funny? i'm not familiar with peter. what was it?,chit-chat
there he goes again he would cry gleefully as michael suddenly dropped like a stone,novel
"haha, that's a good one. i can't wait to see what he's going to do next.",chit-chat
save him save him cried wendy looking with horror at the cruel sea far below,novel
i'm not sure if i could do that. i don't think i could.,chit-chat
eventually peter would dive through the air and catch michael just before he could strike the sea and it was lovely the way he did it but he always waited till the last moment and you felt it was his cleverness that interested him and not the saving of human life,novel
that's really sweet of him. i'm glad he's doing well now.,chit-chat
also he was fond of variety and the sport that engrossed him one moment would suddenly cease to engage him so there was always the possibility that the next time you fell he would let you go,novel
that's a great way to look at it. i'm glad you were able to get away from him.,chit-chat
he could sleep in the air without falling by merely lying on his back and floating but this was partly at least because he was so light that if you got behind him and blew he went faster,novel
that's pretty cool. i'm glad he was able to sleep in the air.,chit-chat
do be more polite to him wendy whispered to john when they were playing follow my leader then tell him to stop showing off said john,novel
that's a good idea. i'm going to try that next time i see him.,chit-chat
when playing follow my leader peter would fly close to the water and touch each sharks tail in passing just as in the street you may run your finger along an iron railing,novel
that sounds like a lot of fun! what kind of sharks do you have in your area?,chit-chat
they could not follow him in this with much success so perhaps it was rather like showing off especially as he kept looking behind to see how many tails they missed,novel
that's a good point. i didn't think of that. i'll have to try that next time.,chit-chat
you must be nice to him wendy impressed on her brothers,novel
i'm not sure if he's impressed or not. i don't know what to do with myself.,chit-chat
what could we do if he were to leave us we could go back michael said,novel
that's a good point. i'm not sure how he would feel about that.,chit-chat
how could we ever find our way back without him well then we could go on said john,novel
i'm sorry to hear that. i hope you're doing better now that he's gone.,chit-chat
that is the awful thing john,novel
"i know, it's so gross. i don't know what i'm going to do about it.",chit-chat
we should have to go on for we dont know how to stop this was true peter had forgotten to show them how to stop,novel
i don't know how to stop it. i'm not sure what to do.,chit-chat
john said that if the worst came to the worst all they had to do was to go straight on for the world was round and so in time they must come back to their own window,novel
that's a good way to look at it. i'm not sure i could do that.,chit-chat
and who is to get food for us john i nipped a bit out of that eagles mouth pretty neatly wendy after the twentieth try wendy reminded him,novel
i'm sorry to hear that. i hope you're able to get some food for him.,chit-chat
and even though we became good at picking up food see how we bump against clouds and things if he is not near to give us a hand indeed they were constantly bumping,novel
that's a good way to look at it. i'm not sure i could do that.,chit-chat
they could now fly strongly though they still kicked far too much but if they saw a cloud in front of them the more they tried to avoid it the more certainly did they bump into it,novel
"that's a good point, i didn't think of that. i'll have to try that.",chit-chat
if nana had been with them she would have had a bandage round michaels forehead by this time,novel
i don't think so. i think it would have been a lot worse if nana had been with them.,chit-chat
peter was not with them for the moment and they felt rather lonely up there by themselves,novel
peter was not with them for the moment and they felt rather lonely up there by themselves...,chit-chat
he could go so much faster than they that he would suddenly shoot out of sight to have some adventure in which they had no share,novel
he could go so much faster than they that he would suddenly shoot out of sight to have some adventure in which they had no share,chit-chat
he would come down laughing over something fearfully funny he had been saying to a star but he had already forgotten what it was or he would come up with mermaid scales still sticking to him and yet not be able to say for certain what had been happening,novel
"oh my gosh, that's so funny! i've had that happen to me before.",chit-chat
it was really rather irritating to children who had never seen a mermaid,novel
oh no! i'm sorry to hear that. i've never seen a mermaid either.,chit-chat
and if he forgets them so quickly wendy argued how can we expect that he will go on remembering us indeed sometimes when he returned he did not remember them at least not well,novel
that's a good point. i don't know if he'll remember them.,chit-chat
wendy was sure of it,novel
i'm not sure what you mean by that. are you referring to the fact that wendy was sure of it?,chit-chat
she saw recognition come into his eyes as he was about to pass them the time of day and go on once even she had to call him by name,novel
that's pretty cool. i've never seen that happen before. what did she do?,chit-chat
im wendy she said agitatedly,novel
"what did she say? i've never heard of agitatedly, but i'm familiar with it.",chit-chat
he was very sorry,novel
i'm sorry to hear that. what did he do to make you feel that way?,chit-chat
i say wendy he whispered to her always if you see me forgetting you just keep on saying im wendy and then ill remember of course this was rather unsatisfactory,novel
i'm sorry to hear that. i hope you're able to get over it.,chit-chat
however to make amends he showed them how to lie out flat on a strong wind that was going their way and this was such a pleasant change that they tried it several times and found that they could sleep thus with security,novel
that's really nice of him to do that for you. i'm glad it worked out for them.,chit-chat
indeed they would have slept longer but peter tired quickly of sleeping and soon he would cry in his captain voice we get off here so with occasional tiffs but on the whole rollicking they drew near the neverland for after many moons they did reach it and what is more they had been going pretty straight all the time not perhaps so much owing to the guidance of peter or tink as because the island was looking for them,novel
"wow, that's really interesting. i've never heard of an island like that before.",chit-chat
it is only thus that any one may sight those magic shores,novel
"that's true, but i'm not sure if i'll ever be able to do it.",chit-chat
there it is said peter calmly,novel
oh really? i didn't know that. i'll have to check it out.,chit-chat
where where where all the arrows are pointing indeed a million golden arrows were pointing it out to the children all directed by their friend the sun who wanted them to be sure of their way before leaving them for the night,novel
"wow, that's a lot of gold! i've never heard of the sun wanting to be sure of their way before leaving them for the night.",chit-chat
wendy and john and michael stood on tiptoe in the air to get their first sight of the island,novel
"hi, how are you today? i just got back from a trip to the island. it's a beautiful place.",chit-chat
strange to say they all recognized it at once and until fear fell upon them they hailed it not as something long dreamt of and seen at last but as a familiar friend to whom they were returning home for the holidays,novel
that's a good way to look at it. it's very strange to think about.,chit-chat
john theres the lagoon wendy look at the turtles burying their eggs in the sand i say john i see your flamingo with the broken leg look michael theres your cave john whats that in the brushwood its a wolf with her whelps,novel
i've never heard of a flamingo before. do you have a name for them?,chit-chat
wendy i do believe thats your little whelp theres my boat john with her sides stove in no it isnt,novel
i'm sorry to hear that. i hope it's not your little whelp.,chit-chat
why we burned your boat thats her at any rate,novel
"i don't know why we burned your boat, but i do know why she did it.",chit-chat
i say john i see the smoke of the redskin camp where,novel
"i've never been to the redskin camp, but i'm familiar with it. what's it like?",chit-chat
show me and ill tell you by the way smoke curls whether they are on the warpath there just across the mysterious river i see now,novel
that's interesting. i've never heard of that before. what's it like?,chit-chat
yes they are on the warpath right enough peter was a little annoyed with them for knowing so much but if he wanted to lord it over them his triumph was at hand for have i not told you that anon fear fell upon them,novel
that's a good point. i didn't think of it that way. it makes sense.,chit-chat
it came as the arrows went leaving the island in gloom,novel
"oh wow, that's pretty cool. what did you do to get the arrow out?",chit-chat
in the old days at home the neverland had always begun to look a little dark and threatening by bedtime,novel
that must have been scary. what did you do to scare the neverland away from you?,chit-chat
then unexplored patches arose in it and spread black shadows moved about in them the roar of the beasts of prey was quite different now and above all you lost the certainty that you would win,novel
that sounds like a lot of fun. what do you like to do in your free time?,chit-chat
you were quite glad that the nightlights were on,novel
"yes, i was. i was so scared of the night lights. i didn't know what to expect.",chit-chat
you even liked nana to say that this was just the mantelpiece over here and that the neverland was all makebelieve,novel
i'm not familiar with the neverland. what's it about? i've never heard of it.,chit-chat
of course the neverland had been makebelieve in those days but it was real now and there were no nightlights and it was getting darker every moment and where was nana,novel
that's a good point. it's hard to believe that the neverland has been around for so long.,chit-chat
they had been flying apart but they huddled close to peter now,novel
that's so sad. i'm sorry to hear that. i hope they're okay.,chit-chat
his careless manner had gone at last his eyes were sparkling and a tingle went through them every time they touched his body,novel
oh no! that's terrible. i hope he's okay. i'm sorry to hear that.,chit-chat
they were now over the fearsome island flying so low that sometimes a tree grazed their feet,novel
"wow, that must have been scary. what did you do to make it up to them?",chit-chat
nothing horrid was visible in the air yet their progress had become slow and laboured exactly as if they were pushing their way through hostile forces,novel
i'm so sorry to hear that. i hope you're able to get back on your feet soon.,chit-chat
sometimes they hung in the air until peter had beaten on it with his fists,novel
that's interesting. i've never heard of that before. do you have a source for that?,chit-chat
they dont want us to land he explained,novel
that's too bad. i'm sorry to hear that. i hope you're able to land soon.,chit-chat
who are they wendy whispered shuddering,novel
"i'm not sure, but i do know that they've been around for a long time.",chit-chat
but he could not or would not say,novel
that's what i was thinking. it's hard to say no to something you love.,chit-chat
tinker bell had been asleep on his shoulder but now he wakened her and sent her on in front,novel
"wow, that's pretty crazy. did he end up doing something to make her feel better?",chit-chat
sometimes he poised himself in the air listening intently with his hand to his ear and again he would stare down with eyes so bright that they seemed to bore two holes to earth,novel
"oh my god, that's the worst! i've had that happen to me before.",chit-chat
having done these things he went on again,novel
that's good to hear. how long did it take for him to do it again?,chit-chat
his courage was almost appalling,novel
i know right? i can't even imagine what it must have been like to be in that situation.,chit-chat
would you like an adventure now he said casually to john or would you like to have your tea first wendy said tea first quickly and michael pressed her hand in gratitude but the braver john hesitated,novel
i would like to have my tea first and michael pressed her hand in gratitude but the braver john hesitated,chit-chat
what kind of adventure he asked cautiously,novel
"he said he wanted to go on a cruise, but i don't know what to do.",chit-chat
theres a pirate asleep in the pampas just beneath us peter told him,novel
oh no! i hope he's okay. i've never seen a pirate sleep in the pampas.,chit-chat
if you like well go down and kill him i dont see him john said after a long pause,novel
that's a good idea. i'll have to do that. thanks for the advice.,chit-chat
i do suppose john said a little huskily he were to wake up peter spoke indignantly,novel
"i don't think so. i think it was more of a "" i'm going to die "" kind of thing.",chit-chat
you dont think i would kill him while he was sleeping,novel
i don't think i would either. i'm not sure i could do that.,chit-chat
i would wake him first and then kill him,novel
that's a good plan. i'm not sure if i could do that though.,chit-chat
thats the way i always do i say,novel
that's the way i always do too. i think it's a good thing.,chit-chat
do you kill many tons john said how ripping but decided to have tea first,novel
"no, i don't kill tons of people. i'm more of a tea drinker.",chit-chat
he asked if there were many pirates on the island just now and peter said he had never known so many,novel
"oh wow, that's interesting. i wonder how many of them were on the island.",chit-chat
who is captain now hook answered peter and his face became very stern as he said that hated word,novel
who is captain now hook answered peter and his face became very stern as he said that hate word,chit-chat
jas,novel
have you ever been to the state of virginia? it's a state in the southeastern region of the united states.,chit-chat
hook ay then indeed michael began to cry and even john could speak in gulps only for they knew hooks reputation,novel
hook ay is one of my favorite hip hop artists. do you like hook ay as well?,chit-chat
he was blackbeards bosun john whispered huskily,novel
i've never heard of him. what does he do for a living? do you have any hobbies?,chit-chat
he is the worst of them all,novel
i know right? i can't even imagine what it must be like to have to deal with that.,chit-chat
he is the only man of whom barbecue was afraid thats him said peter,novel
i'm sorry to hear that. i hope you're able to talk to him about it.,chit-chat
what is he like,novel
"he's a good guy, but i'm not sure if i can trust him.",chit-chat
is he big he is not so big as he was how do you mean i cut off a bit of him you yes me said peter sharply,novel
i'm sorry to hear that. i hope you're able to get over it.,chit-chat
i wasnt meaning to be disrespectful oh all right but i say what bit his right hand then he cant fight now oh cant he just lefthander he has an iron hook instead of a right hand and he claws with it claws i say john said peter,novel
that's not disrespectful at all. i'm not sure what you're talking about.,chit-chat
yes say ay ay sir ay ay sir there is one thing peter continued that every boy who serves under me has to promise and so must you john paled,novel
i'm sorry to hear that. i hope you're doing well in your life.,chit-chat
it is this if we meet hook in open fight you must leave him to me i promise john said loyally,novel
john said loyally? what did he say? i'm not familiar with hook.,chit-chat
for the moment they were feeling less eerie because tink was flying with them and in her light they could distinguish each other,novel
that's really cool. i'm glad you were able to see them in the light.,chit-chat
unfortunately she could not fly so slowly as they and so she had to go round and round them in a circle in which they moved as in a halo,novel
oh no! i'm so sorry to hear that. i hope she's okay.,chit-chat
wendy quite liked it until peter pointed out the drawbacks,novel
what drawbacks did he point out? i'm not familiar with peter's work.,chit-chat
she tells me he said that the pirates sighted us before the darkness came and got long tom out the big gun yes,novel
"wow, that's amazing! i'm glad he was able to get out of the big gun!",chit-chat
and of course they must see her light and if they guess we are near it they are sure to let fly wendy john michael tell her to go away at once peter the three cried simultaneously but he refused,novel
"i don't know who john michael is, but i do know he's a liar.",chit-chat
she thinks we have lost the way he replied stiffly and she is rather frightened,novel
that's not good. i'm sorry to hear that. what did he say?,chit-chat
you dont think i would send her away all by herself when she is frightened for a moment the circle of light was broken and something gave peter a loving little pinch,novel
i don't think i'd do that either. i'm not sure i could do that.,chit-chat
then tell her wendy begged to put out her light she cant put it out,novel
that's a good idea. i think i'm going to do that next time.,chit-chat
that is about the only thing fairies cant do,novel
that's true. i'm not sure if i'll be able to do it again.,chit-chat
it just goes out of itself when she falls asleep same as the stars then tell her to sleep at once john almost ordered,novel
that's a good idea. i think i'm going to have to do that.,chit-chat
she cant sleep except when shes sleepy,novel
i'm sorry to hear that. do you have any idea why she can't sleep?,chit-chat
it is the only other thing fairies cant do seems to me growled john these are the only two things worth doing here he got a pinch but not a loving one,novel
i'm sorry to hear that. i hope you're able to find peace in your life.,chit-chat
if only one of us had a pocket peter said we could carry her in it however they had set off in such a hurry that there was not a pocket between the four of them,novel
i'm sorry to hear that. i hope you're able to get her back.,chit-chat
he had a happy idea,novel
that's good to hear. it's always good to have a happy idea like that.,chit-chat
johns hat,novel
have you ever heard of the hat hat? it's a hat made by john hat.,chit-chat
tink agreed to travel by hat if it was carried in the hand,novel
tink agreed to travel by hat if it was carried in the hand. that's great!,chit-chat
john carried it though she had hoped to be carried by peter,novel
"oh, that's interesting. i didn't know that. do you know who john was?",chit-chat
presently wendy took the hat because john said it struck against his knee as he flew and this as we shall see led to mischief for tinker bell hated to be under an obligation to wendy,novel
i'm sorry to hear that. i hope you're able to get the hat back.,chit-chat
in the black topper the light was completely hidden and they flew on in silence,novel
"wow, that must have been scary. did you have to get out of the car to get to it?",chit-chat
it was the stillest silence they had ever known broken once by a distant lapping which peter explained was the wild beasts drinking at the ford and again by a rasping sound that might have been the branches of trees rubbing together but he said it was the redskins sharpening their knives,novel
"wow, that's really interesting. i've never heard of the redskins before. what did they sharpen their knives for?",chit-chat
even these noises ceased,novel
i don't think i've ever heard a noise like that in my life. do you?,chit-chat
to michael the loneliness was dreadful,novel
i'm sorry to hear that. do you have anyone you can talk to about it?,chit-chat
if only something would make a sound he cried,novel
i'm sorry to hear that. i hope you're able to get over it.,chit-chat
as if in answer to his request the air was rent by the most tremendous crash he had ever heard,novel
i'm sorry to hear that. i hope he was able to get out of it.,chit-chat
the pirates had fired long tom at them,novel
i'm sorry to hear that. what did they do to get rid of long tom?,chit-chat
the roar of it echoed through the mountains and the echoes seemed to cry savagely where are they where are they where are they thus sharply did the terrified three learn the difference between an island of makebelieve and the same island come true,novel
i've never heard of makebelieve before. what's the difference between makebelieve and makebelieve?,chit-chat
when at last the heavens were steady again john and michael found themselves alone in the darkness,novel
that's so sad. i'm sorry to hear that. what happened to john and michael?,chit-chat
john was treading the air mechanically and michael without knowing how to float was floating,novel
john was treading the air and michael without knowing how to float was floating? that's interesting.,chit-chat
are you shot john whispered tremulously,novel
i'm not sure what you mean by that. are you asking if i shot john?,chit-chat
i havent tried yet michael whispered back,novel
i've never heard of him. what does he do for a living? i'm not familiar with him.,chit-chat
we know now that no one had been hit,novel
i'm so sorry to hear that. i hope you're okay. what happened?,chit-chat
peter however had been carried by the wind of the shot far out to sea while wendy was blown upwards with no companion but tinker bell,novel
that's really sad. i'm sorry to hear that. what happened to wendy?,chit-chat
it would have been well for wendy if at that moment she had dropped the hat,novel
"yeah, that would have been a great moment for her. i was so proud of her.",chit-chat
i dont know whether the idea came suddenly to tink or whether she had planned it on the way but she at once popped out of the hat and began to lure wendy to her destruction,novel
that's really interesting. did you find out who she was or what she was up to?,chit-chat
tink was not all bad or rather she was all bad just now but on the other hand sometimes she was all good,novel
i'm sorry to hear that. i hope she's doing better now. what happened to her?,chit-chat
fairies have to be one thing or the other because being so small they unfortunately have room for one feeling only at a time,novel
that's a good point. it's hard for me to believe that fairies are real.,chit-chat
they are however allowed to change only it must be a complete change,novel
"that's true, but i don't know if i'm going to do it.",chit-chat
at present she was full of jealousy of wendy,novel
i'm sorry to hear that. what did she do to make you jealous of her?,chit-chat
what she said in her lovely tinkle wendy could not of course understand and i believe some of it was bad words but it sounded kind and she flew back and forward plainly meaning follow me and all will be well what else could poor wendy do,novel
what did she say in her lovely tinkle wendy could not understand and i believe some of it was bad words but it sounded kind and she flew back and forward plainly meaning follow me and all will well what else could poor wendy do,chit-chat
she called to peter and john and michael and got only mocking echoes in reply,novel
i'm sorry to hear that. i hope you're able to work things out.,chit-chat
she did not yet know that tink hated her with the fierce hatred of a very woman,novel
i'm sorry to hear that. what did tink do to make you hate her?,chit-chat
